company_name,email,phone,website,snippet,commodity,source,collection_date,data_quality_score,additional_emails,additional_phones
Contact from https://www.marvellfoods.com/frozen-food-distributors/,johnpaul@marvellfoods.com,414-377-8216,https://www.marvellfoods.com/frozen-food-distributors/,Deep scraped from https://www.marvellfoods.com/frozen-food-distributors/,Frozen Poultry and Foods,Website Deep Scrape,2025-09-25 20:34:31,75,"Joseph@MarvellFoods.com, joseph@marvellfoods.com, jeff@thebambooagency.com","954-801-8263, 414-331-1691, 480 522 5855, 480-522-5855"
Contact from https://www.marvellfoods.com/frozen-food-distributors/,Joseph@MarvellFoods.com,414-377-8216,https://www.marvellfoods.com/frozen-food-distributors/,Deep scraped from https://www.marvellfoods.com/frozen-food-distributors/,Frozen Poultry and Foods,Website Deep Scrape,2025-09-25 20:34:31,75,"Joseph@MarvellFoods.com, joseph@marvellfoods.com, jeff@thebambooagency.com","954-801-8263, 414-331-1691, 480 522 5855, 480-522-5855"
Contact from https://www.marvellfoods.com/frozen-food-distributors/,joseph@marvellfoods.com,414-377-8216,https://www.marvellfoods.com/frozen-food-distributors/,Deep scraped from https://www.marvellfoods.com/frozen-food-distributors/,Frozen Poultry and Foods,Website Deep Scrape,2025-09-25 20:34:31,75,"Joseph@MarvellFoods.com, joseph@marvellfoods.com, jeff@thebambooagency.com","954-801-8263, 414-331-1691, 480 522 5855, 480-522-5855"
Contact from https://ensun.io/search/frozen-poultry/united-states,info@ensun.de,271 3388120,https://ensun.io/search/frozen-poultry/united-states,Deep scraped from https://ensun.io/search/frozen-poultry/united-states,Frozen Poultry and Foods,Website Deep Scrape,2025-09-25 20:34:39,75,,+49 271 3388120
Contact from https://www.frozen-goods.com/frozen-meat-product-manufacturers-suppliers-processors-usa/,contactus@ruizfoods.com,800.225.1180,https://www.frozen-goods.com/frozen-meat-product-manufacturers-suppliers-processors-usa/,Deep scraped from https://www.frozen-goods.com/frozen-meat-product-manufacturers-suppliers-processors-usa/,Frozen Poultry and Foods,Website Deep Scrape,2025-09-25 20:34:48,75,,"800 969 2747, (847) 384-5961, (800) 477-6474, 479-290-4000, (847) 384-5940"
Creek Plastics,,,https://creekplastics.com/,"Creek Plastics is a U.S. owned and operated manufacturer of plastic products made for protecting fiber and cable in your telecommunications, CATV, and electrical applications. We produce a wide variety of pipe for multiple applications. We have over ",Plastic Pipes,DuckDuckGo Search,2025-09-25 20:37:17,35,,
Cresline Plastic Pipe Co.,,,https://www.cresline.com/,"Cresline Plastic Pipe Co., Inc. is the oldest privately-owned plastic pipe company operating today. The Cresline Team is comprised of the industry's most experienced professionals who are the backbone of our success. As one of the largest full-line p",Plastic Pipes,DuckDuckGo Search,2025-09-25 20:37:17,35,,
Plastic Pipe Suppliers,,,https://www.thomasnet.com/suppliers/usa/plastic-pipe-58530403,"Custom Manufacturer* , Manufacturer ⚫ $1 - 4.9 Mil Revenue ⚫ Est. 1948 Manufacturer of drop and U plastic pipe made from PVC. Other products available include hose weights, covers, cords and power extension. More + Contact Supplier Request Informatio",Plastic Pipes,DuckDuckGo Search,2025-09-25 20:37:17,35,,
Hawk Plastics Corp,,,https://www.hawkplasticscorp.com/,Hawk Plastics is an award-winning PVC pipe manufacturer. We extrude standard and custom PVC pipe. Pipe that is used by contractors and municipalities as well as manufacturers.,Plastic Pipes,DuckDuckGo Search,2025-09-25 20:37:17,35,,
Custom Plastic Cores and Pipes,,,https://www.apiplastics.com/,"Available Plastics A key source of custom plastic pipe, tube and products for Manufacturers, Wholesalers and Distributors throughout North America. View Our Custom Services",Plastic Pipes,DuckDuckGo Search,2025-09-25 20:37:17,35,,
78 Plastic Pipe Manufacturers in 2025,,,https://us.metoree.com/categories/4464/,"78 Plastic Pipe Manufacturers in 2025 This section provides an overview for plastic pipe as well as their applications and principles. Also, please take a look at the list of 78 plastic pipe manufacturers and their company rankings. Here are the top-",Plastic Pipes,DuckDuckGo Search,2025-09-25 20:37:17,35,,
Home,,,https://www.slpipe.com/,"Silver-Line Plastics is a manufacturer of some of the industry's highest quality plastic pipe products made in the USA. We offer our customers one of the industry's most comprehensive product lines, featuring PVC, CPVC, Polyethylene, Geothermal, and ",Plastic Pipes,DuckDuckGo Search,2025-09-25 20:37:17,35,,
"Custom HDPE Pipe, quality built in the USA",,,https://unitedpolysystems.com/,"High quality polyethylene pipe manufacturer With convenient locations across the country, we manufacture high and medium density conduit and pressure polyethylene pipe for the energy and telecommunications markets. Our products are UL Listed, NSF cer",Plastic Pipes,DuckDuckGo Search,2025-09-25 20:37:17,35,,
JM Eagle™: World's Largest Plastic and PVC Pipe Manufacturer,,,https://jmeagle.com/,"Plastic pipe exceeds iron pipe in durability, longevity, and performance. Independent studies by the American Water Works Association Research Foundation and the Plastic Pipes Institute show PVC and PE, respectively, last longer than 100 years.",Plastic Pipes,DuckDuckGo Search,2025-09-25 20:37:17,35,,
PPI Find A Manufacturer,,,https://www.plasticpipe.org/PPI-Home/PPI-Home/Find-A-Manufacturer-2.0.aspx,"The Find A Manufacturer tool is here to assist you in identifying product solutions based on your specific project. By using the drop down, you will be able to locate PPI member companies to assist you with your needs based on either the Market, Appl",Plastic Pipes,DuckDuckGo Search,2025-09-25 20:37:17,35,,
Contact from https://creekplastics.com/,dan@creekplastics.com,517-423-1178,https://creekplastics.com/,Deep scraped from https://creekplastics.com/,Plastic Pipes,Website Deep Scrape,2025-09-25 20:37:28,75,,
Contact from https://www.apiplastics.com/,apishipping@apiplastics.com,800-633-7212,https://www.apiplastics.com/,Deep scraped from https://www.apiplastics.com/,Plastic Pipes,Website Deep Scrape,2025-09-25 20:38:22,75,sales@apiplastics.com,"256-851-7723, 256-859-4957"
Contact from https://www.apiplastics.com/,sales@apiplastics.com,800-633-7212,https://www.apiplastics.com/,Deep scraped from https://www.apiplastics.com/,Plastic Pipes,Website Deep Scrape,2025-09-25 20:38:22,75,sales@apiplastics.com,"256-851-7723, 256-859-4957"
Contact from https://unitedpolysystems.com/,mdeneen@atkore.com,224.628.4230,https://unitedpolysystems.com/,Deep scraped from https://unitedpolysystems.com/,Plastic Pipes,Website Deep Scrape,2025-09-25 20:39:10,75,"btucker@atkore.com, bberkebile@atkore.com, acordova@atkore.com, scohen@atkore.com, psharkey@atkore.com, ttitus@atkore.com, tbracci@atkore.com, wbryan@atkore.com","770.331.2840, 541.735.3293, 301.433.7950, 810.445.6739, 615.939.7238, 214.537.2587"
Contact from https://unitedpolysystems.com/,btucker@atkore.com,224.628.4230,https://unitedpolysystems.com/,Deep scraped from https://unitedpolysystems.com/,Plastic Pipes,Website Deep Scrape,2025-09-25 20:39:10,75,"btucker@atkore.com, bberkebile@atkore.com, acordova@atkore.com, scohen@atkore.com, psharkey@atkore.com, ttitus@atkore.com, tbracci@atkore.com, wbryan@atkore.com","770.331.2840, 541.735.3293, 301.433.7950, 810.445.6739, 615.939.7238, 214.537.2587"
Contact from https://unitedpolysystems.com/,bberkebile@atkore.com,224.628.4230,https://unitedpolysystems.com/,Deep scraped from https://unitedpolysystems.com/,Plastic Pipes,Website Deep Scrape,2025-09-25 20:39:10,75,"btucker@atkore.com, bberkebile@atkore.com, acordova@atkore.com, scohen@atkore.com, psharkey@atkore.com, ttitus@atkore.com, tbracci@atkore.com, wbryan@atkore.com","770.331.2840, 541.735.3293, 301.433.7950, 810.445.6739, 615.939.7238, 214.537.2587"
Cheese Manufacturers and Wholesalers,,,https://mfg.regionaldirectory.us/cheese/,"This Cheese manufacturer and distributor directory includes cheese manufacturer entries for many States in the USA plus Washington, DC. This directory page lists cheese manufacturers and distributors that are located throughout the USA, including the",Cheese,DuckDuckGo Search,2025-09-25 20:40:44,35,,
DairyfoodUSA.com,,,https://dairyfoodusa.com/,"DairyfoodUSA is a private label cheese manufacturing that provides cheese to other manufacturers, specializing in creating innovative and unique cheese recipes.",Cheese,DuckDuckGo Search,2025-09-25 20:40:44,35,,
Murray'S Cheese Wholesale,,,https://www.murrayscheese.com/wom/wholesale,"Murray's Cheese Wholesale offers high-quality cheeses, charcuterie, and specialty foods for restaurants and more.",Cheese,DuckDuckGo Search,2025-09-25 20:40:44,35,,
Cheese Manufacturers and Suppliers in the USA and Canada,,,https://www.thomasnet.com/suppliers/usa/cheese-97013725,"Manufacturer of plant-based, organic, vegan and gluten-free food products and ingredients. Products include textured and creamy proteins, starch, grains, all-purpose flour, soybeans, seeds, plant-based meats, oatmeal, mug cakes, apple cider vinegar g",Cheese,DuckDuckGo Search,2025-09-25 20:40:44,35,,
List of Companies,,,https://www.thinkusadairy.org/specialty-cheeses-new/companies-list,List of Companies | ThinkUSAdairy by the U.S. Dairy Export CouncilU.S. Specialty Cheese Gallery List of Companies,Cheese,DuckDuckGo Search,2025-09-25 20:40:44,35,,
Top Cheese Manufacturers In USA: A Comprehensive Guide,,,https://cheesepath.com/top-cheese-manufacturers-in-usa/,"So, get ready to explore the top cheese manufacturers in the USA, and learn just how much they add to our tasty food scene. Discover our more articles on Where to Buy Manchego Cheese, Where To Buy Real Parmesan Cheese and Where To Buy Grilling Cheese",Cheese,DuckDuckGo Search,2025-09-25 20:40:44,35,,
Marwood Sales,,,https://marwoodsales.com/products/,"As natural cheese suppliers, Marwood Sales provides high quality cheese for distributors, processors, and manufacturers along with great customer service. Our goal is to provide you with the formulations, pack sizes, and blends you need for your food",Cheese,DuckDuckGo Search,2025-09-25 20:40:44,35,,
Nation's Leading Natural Cheese Packager,,,https://www.greatlakescheese.com/,"The Nation's Leading Natural Cheese Packager Great Lakes Cheese is an award-winning, premier manufacturer and packager of natural and processed bulk, shredded, and sliced cheeses.",Cheese,DuckDuckGo Search,2025-09-25 20:40:44,35,,
Peterson Company,,,https://www.petersoncheese.com/,"Discover the finest specialty foods for your business at Peterson Company. As a trusted family-owned importer, converter, and distributor, we are committed to delivering exceptional service and top-quality products.",Cheese,DuckDuckGo Search,2025-09-25 20:40:44,35,,
Global Foods International,,,https://www.globalfoodsintl.com/,"As the 4th generation specialty cheese manufacturer and converter, we specialize in cheese conversions, private labeling, and bulk & industrial packaging.",Cheese,DuckDuckGo Search,2025-09-25 20:40:44,35,,
U.S. Dairy Supplier Directory,,,https://www.thinkusadairy.org/applications/supplier-search?CategoryID=61,"U.S. manufacturers provide a wide range of cheese from European-styles to American Originals and everything in-between. From East Coast to West Coast, U.S. suppliers are focused on customer needs and are ready and eager to partner with them all aroun",Cheese,DuckDuckGo Search,2025-09-25 20:40:44,35,,
Cheese Suppliers from United States,,,https://www.volza.com/p/cheese/manufacturers/manufacturers-in-united-states/,"Volza list of active United States Cheese Suppliers and Exporters contains Supplier name, address & Top decision makers with phone, email & LinkedIn profile, it also contains strategic information of each shipment like product, export price, quantity",Cheese,DuckDuckGo Search,2025-09-25 20:40:44,35,,
American Cheese Company,,,https://www.americancheesecompany.com/,The American Cheese Company is a renowned purveyor of artisanal cheeses that represents the best of American cheese-making. Our collection features the finest luxury cheeses produced in the United States today.,Cheese,DuckDuckGo Search,2025-09-25 20:40:44,35,,
Cheese Merchants,,,https://cheesemerchants.com/,"A family of cheese experts with a dedication to quality and customer service, converting and delivering premium cheeses with exceptional customer focus.",Cheese,DuckDuckGo Search,2025-09-25 20:40:44,35,,
Cheese for Wholesale and Food Service,,,https://nasonvilledairy.com/wholesale/,Get award-winning cheese for wholesale distributors and food service businesses from the experts at Nasonville Dairy. We're committed to efficiency and flavor.,Cheese,DuckDuckGo Search,2025-09-25 20:40:44,35,,
Contact from https://dairyfoodusa.com/,info@DairyfoodUSA.com,(608) 437-5598,https://dairyfoodusa.com/,Deep scraped from https://dairyfoodusa.com/,Cheese,Website Deep Scrape,2025-09-25 20:40:59,75,,(800) 555-1212
Contact from https://www.murrayscheese.com/wom/wholesale,education@murrayscheese.com,+18886924339,https://www.murrayscheese.com/wom/wholesale,Deep scraped from https://www.murrayscheese.com/wom/wholesale,Cheese,Website Deep Scrape,2025-09-25 20:41:11,75,"events@murrayscheese.com, orders@murrayscheese.com, buying@murrayscheese.com, wholesale@murrayscheese.com","+12122433289, 212-243-3289, 1212243328, 212.243.3289, 888-692-4339, 1888692433, 646-553-3484"
Contact from https://www.murrayscheese.com/wom/wholesale,events@murrayscheese.com,+18886924339,https://www.murrayscheese.com/wom/wholesale,Deep scraped from https://www.murrayscheese.com/wom/wholesale,Cheese,Website Deep Scrape,2025-09-25 20:41:11,75,"events@murrayscheese.com, orders@murrayscheese.com, buying@murrayscheese.com, wholesale@murrayscheese.com","+12122433289, 212-243-3289, 1212243328, 212.243.3289, 888-692-4339, 1888692433, 646-553-3484"
Contact from https://www.murrayscheese.com/wom/wholesale,orders@murrayscheese.com,+18886924339,https://www.murrayscheese.com/wom/wholesale,Deep scraped from https://www.murrayscheese.com/wom/wholesale,Cheese,Website Deep Scrape,2025-09-25 20:41:11,75,"events@murrayscheese.com, orders@murrayscheese.com, buying@murrayscheese.com, wholesale@murrayscheese.com","+12122433289, 212-243-3289, 1212243328, 212.243.3289, 888-692-4339, 1888692433, 646-553-3484"
Top 17 Food Manufacturing Companies in the US,,,https://www.inven.ai/company-lists/top-17-food-manufacturing-companies-in-the-us,"The food manufacturing industry in the US plays a crucial role in the economy by transforming raw agricultural products into consumable goods. Companies in this sector range from large corporations to local enterprises, focusing on a wide variety of ",Fresh Food,DuckDuckGo Search,2025-09-25 20:43:22,35,,
Fresh and Ready Foods,,,https://www.freshandreadyfoods.com/,"As a fresh food supplier, we maintain a highly effective and detailed food safety program under the guidance of our quality assurance team. Our facilities follow the strict guidelines of food safety and sanitation reflected in our Sanitation Procedur",Fresh Food,DuckDuckGo Search,2025-09-25 20:43:22,35,,
Walker's Fresh Foods,,,https://walkersfoodproducts.com/,"We're dedicated to being the best prepared food and beverage manufacturer in the industry, and that dedication shows in the many national and local chains that depend on us. Our focus on quality foods at affordable prices makes us the ideal prepared ",Fresh Food,DuckDuckGo Search,2025-09-25 20:43:22,35,,
The Fresh Factory: Clean-Label Food Manufacturing,,,https://thefreshfactory.co/,"Our team has deep expertise in fresh plant-based, clean-label ingredients, and we have relationships with the majority of leading distributors and retailers. Find out how we can help grow your brand through food product development, manufacturing, fu",Fresh Food,DuckDuckGo Search,2025-09-25 20:43:22,35,,
Contact Us,,800-367-5690,https://www.freshpoint.com/contact-us/,"1-800-367-5690 Code: 10908 As the largest wholly owned & operated produce distributor in North America, here are the benefits that set us apart: Dedicated Produce Specialist and in-office customer service. MyFreshPoint.com online ordering platform. G",Fresh Food,DuckDuckGo Search,2025-09-25 20:43:22,65,,
Organic & Fresh Food,,,https://www.fsproduce.com/,"Helping Others Succeed in Fresh Four Seasons Produce, Inc. is a family-owned, full-service wholesale distributor of organic and conventional produce, plus fresh items, serving independent retailers, natural food stores, and other professional buyers ",Fresh Food,DuckDuckGo Search,2025-09-25 20:43:22,35,,
Natural Foods Manufacturing/Supply Chain,,,https://frescafoodsinc.com/,"Natural and organic food co-manufacturers, co-packers, and product innovators. We get high-quality, shelf-stable food concepts market-ready with all the relevant certifications. Driven by our purpose to nourish lives, we promise (and deliver) high-qu",Fresh Food,DuckDuckGo Search,2025-09-25 20:43:22,35,,
Home,,,https://www.bernicesfoods.com/,"Bernice's Foods, Inc. is a premier manufacturer of custom prepared fresh foods and contract food processor / packer. Our experience, equipment and flexible production methodologies enable us to offer a broad variety of food products that meet the hig",Fresh Food,DuckDuckGo Search,2025-09-25 20:43:22,35,,
Natural Yogurt Parfait and Fresh Cut Fruit Supplier,,,https://www.winkleblacks.com/,"Renowned for fresh, affordable produce, great customer service and timely delivery. Our incredibly high standards ensure we meet and exceed your expectations. Every time. In doing so we have become one of the largest and most reputable pre-packaged f",Fresh Food,DuckDuckGo Search,2025-09-25 20:43:22,35,,
Charlie's Produce,,,https://www.charliesproduce.com/,"Our Services With decades of experience in buying, selling, and merchandising, we supply restaurants, grocery stores, institutions, wholesalers, the marine industry, and more with a full range of services. We offer conventional, organic, and specialt",Fresh Food,DuckDuckGo Search,2025-09-25 20:43:22,35,,
Supplier Information,,,https://www.usfoods.com/supplier-info.html,US Foods Product Content Specification Guidelines How to Become a US Foods Vendor - Contact the Local Market in Your Area and Speak with the Procurement Team. Corporate Credit Letter/Bill to Address/Contact Information US Foods W9 Trans-Porte W9 Bran,Fresh Food,DuckDuckGo Search,2025-09-25 20:43:22,35,,
List of Wholesale Food Distributors in USA,,,https://www.foodcodirectory.com/2021/08/us-food-distributors-importers.html,Wholesale food distributors play a crucial role in ensuring a steady and efficient supply chain to meet the needs of food service and retail industry. FoodCoDirectory contains a comprehensive list of Wholesale food distributors in the United States i,Fresh Food,DuckDuckGo Search,2025-09-25 20:43:22,35,,
"Wholesale Foods, Salads, Sandwiches & Snacks",,,https://www.kitchenfreshfoods.com/,Feeding America Fresh Food Kitchen Fresh Foods is a USDA-approved wholesale food distributor and full-service kitchen providing the freshest convenience foods while exceeding the highest standards of the food safety industry. Whether you own a large-,Fresh Food,DuckDuckGo Search,2025-09-25 20:43:22,35,,
Contact Farm Fresh Food Suppliers,mdufour@farmfreshfood.com,,http://www.farmfreshfood.com/contact.html,"Information received from any customer will be used for internal purposes and will not be sold or provided to third parties. If you have already provided this information and do not wish to receive e-mail or materials from us in the future, please le",Fresh Food,DuckDuckGo Search,2025-09-25 20:43:22,75,,
Fresh-Link Produce,,,https://www.freshlinkproduce.com/,"Fresh-Link Produce utilizes our large network of growers and shippers to support retailers, wholesalers, and food service operators, ensuring a constant supply of fresh, high-quality produce.",Fresh Food,DuckDuckGo Search,2025-09-25 20:43:22,35,,
Contact from https://www.inven.ai/company-lists/top-17-food-manufacturing-companies-in-the-us,Sourcescrub@inven.aiSign,501-1000190,https://www.inven.ai/company-lists/top-17-food-manufacturing-companies-in-the-us,Deep scraped from https://www.inven.ai/company-lists/top-17-food-manufacturing-companies-in-the-us,Fresh Food,Website Deep Scrape,2025-09-25 20:43:29,75,,"001-5000192, 501-1000201, 001-5000198, 001-1000019, 001-5000193, 001-5000194, 001-5000199, 501-1000191"
Contact from https://thefreshfactory.co/,info@thefreshfactory.co,(708) 202-9715,https://thefreshfactory.co/,Deep scraped from https://thefreshfactory.co/,Fresh Food,Website Deep Scrape,2025-09-25 20:44:21,75,Relationshealthyinvestors@thefreshfactory.co,
Contact from https://thefreshfactory.co/,Relationshealthyinvestors@thefreshfactory.co,(708) 202-9715,https://thefreshfactory.co/,Deep scraped from https://thefreshfactory.co/,Fresh Food,Website Deep Scrape,2025-09-25 20:44:21,75,Relationshealthyinvestors@thefreshfactory.co,
Contact from https://frescafoodsinc.com/,hello@frescafoodsinc.comFax,(303) 665-8563,https://frescafoodsinc.com/,Deep scraped from https://frescafoodsinc.com/,Fresh Food,Website Deep Scrape,2025-09-25 20:44:57,75,HR@frescafoodsinc.com,"(303) 645-4884, (303) 996-8881"
Contact from https://frescafoodsinc.com/,HR@frescafoodsinc.com,(303) 665-8563,https://frescafoodsinc.com/,Deep scraped from https://frescafoodsinc.com/,Fresh Food,Website Deep Scrape,2025-09-25 20:44:57,75,HR@frescafoodsinc.com,"(303) 645-4884, (303) 996-8881"
Hemp Acres: American Made Wholesale Hemp Ingredients,,,https://www.hempacresusa.com/,"Hemp Acres is a hemp processing facility located in Minnesota, focused on producing hemp grain, hemp seed oil, hemp botanical extracts, and hemp stalk ingredients for wholesale. Manufacturers use our hemp ingredients for food, CPG, or Industrial prod",Hemp Bio Mass,DuckDuckGo Search,2025-09-25 20:45:48,35,,
Hemp Life Nation,,,https://hemplifenation.com/,"With all of our HLN strategic partners, we have over 20 years in the Industry. We offer the highest quality lots with 9% to 18% CBD. All on under the federal guideline for THC. Up to date COA on all lots. We can provide all your inventory processing ",Hemp Bio Mass,DuckDuckGo Search,2025-09-25 20:45:48,35,,
Panda Biotech,,,https://www.pandabiotech.com/,"Panda Biotech, LLC is a first-mover in the emerging U.S. industrial hemp premium, textile-grade, natural fiber and cellulose industry.",Hemp Bio Mass,DuckDuckGo Search,2025-09-25 20:45:48,35,,
International Hemp,,,https://www.international-hemp.com/,"North America's Leading Certified Hemp Seed Supplier International Hemp is a seed and genetics company that has been at the forefront of providing U.S. farmers with certified, high-yielding industrial hemp genetics for more than half a decade. Throug",Hemp Bio Mass,DuckDuckGo Search,2025-09-25 20:45:48,35,,
Wholesale Hemp Suppliers: White-label CBD & Delta 8 & Delta 9,,,https://wholesalehempsuppliers.com/,"Wholesale Hemp Suppliers isn't just a CBD & Delta 8 manufacturer, we're here to be your partner. In addition to CBD, Delta 8, and minor cannabinoid products you can count on, world-class customer support, and bulk discounts, we offer minimum orders a",Hemp Bio Mass,DuckDuckGo Search,2025-09-25 20:45:48,35,,
Wholesale Hemp Biomass,,,https://hempex.com/wholesale-hemp-biomass/,"Wholesale Hemp Biomass At Hempex, our commitment to quality starts at the source. As the retail and wholesale face of Rhizo Sciences, we work directly with large-scale cultivators and processors to source and distribute premium hemp biomass internati",Hemp Bio Mass,DuckDuckGo Search,2025-09-25 20:45:48,35,,
Colorado Hemp Works,,,https://coloradohempworks.com/,"As the first US-based commercial processor, Colorado Hemp Works offers natural food companies hand-crafted, on-demand industrial hemp grain processing. We wholesale a wide range of food-grade products derived from this versatile seed, and we provide ",Hemp Bio Mass,DuckDuckGo Search,2025-09-25 20:45:48,35,,
Bastcore,,,https://bastcore.com/,"The company has been consistently innovating, tailoring, and perfecting the creation of premier hemp products from the bast and hurd (wood) and expanding the use-cases for the full hemp plant - sustainable use cases that benefit producers and manufac",Hemp Bio Mass,DuckDuckGo Search,2025-09-25 20:45:48,35,,
Industrial Hemp Seed Supplier,,,https://kandahemp.com/,"Hemp grain is a versatile, nutrient-rich ingredient, suitable for direct consumption or processing into products like hemp milk and oil, benefiting humans, animals, and biofuel production.",Hemp Bio Mass,DuckDuckGo Search,2025-09-25 20:45:48,35,,
Industrial Hemp Products & Solutions,,,https://biofiberindustrie.com/,"We deliver full cycle, innovative, responsible, sustainable and regenerative solutions from diverse crops including hemp biomass, resulting in hemp products ranging from hempcrete building materials to hemp fabrics used in a wide assortment of eco-fr",Hemp Bio Mass,DuckDuckGo Search,2025-09-25 20:45:48,35,,
Contact from https://www.international-hemp.com/,info@international-hemp.com,833-937-4367,https://www.international-hemp.com/,Deep scraped from https://www.international-hemp.com/,Hemp Bio Mass,Website Deep Scrape,2025-09-25 20:46:20,75,,
Contact from https://wholesalehempsuppliers.com/,930-0223info@wholesalehempsuppliers.com,8009300223,https://wholesalehempsuppliers.com/,Deep scraped from https://wholesalehempsuppliers.com/,Hemp Bio Mass,Website Deep Scrape,2025-09-25 20:46:31,75,info@wholesalehempsuppliers.com,"800.930.0223, (800)-930-0223"
