company_name,email,phone,website,snippet,commodity,source,collection_date,data_quality_score,additional_emails,additional_phones
Paper Converting Services Suppliers,,,https://www.thomasnet.com/suppliers/usa/paper-converters-56901606,Paper Converting Services Suppliers Welcome to this comprehensive resource for Paper Converting Services Suppliers and Manufacturers on Thomas. Here you can find any Paper Converting Services Suppliers that suits your needs. If Ownership Diversity is,Paper Converting,DuckDuckGo Search,2025-09-25 20:19:00,35,,
"Industrial Paper Converting Manufacturer, Custom Paper Converters ...",,,https://kraftwrap.com/paper-converter-manufacturer-custom-paper-converting-factory-usa-facility,Premier Paper Converter - Experienced Paper Converting Services Kraft Wrap is an experienced paper converting manufacturer. We are a custom contract converting company serving customers across the USA and the world. We been specializing in contract p,Paper Converting,DuckDuckGo Search,2025-09-25 20:19:00,35,,
"Welcome to CT Commercial Paper, LLC",,,https://ctcpaper.com/,"2024 Celebrates our 25 year milestone and ushers in another new converting line. 2024 marks 25 years in business for CT Commercial Paper LLC and celebrates over 2 decades of direct, hands-on experience, and a continued dedication and commitment to co",Paper Converting,DuckDuckGo Search,2025-09-25 20:19:00,35,,
United States: Paper Converters,,,https://www.paperindex.com/paper-converters-in-united-states/8/9,"Sullivan Paper Co., Inc. is located in West Springfield, Massachusetts, USA. We are a Rotogravure and Flexographic Gift Wrap and Box Wrap Printer and Converter that have been supplying this trade... View profile Profile recently viewed by buyers from",Paper Converting,DuckDuckGo Search,2025-09-25 20:19:00,35,,
"Shamrock Paper Company, your paper converter industry leader",,,https://shamrockpaper.com/,Shamrock Paper supplies the industry with superior products and exceptional services. Our prices are competitive and fair. We have over 45 years experience in paper product manufacturing. Our dedicated staff and state of the art equipment continues t,Paper Converting,DuckDuckGo Search,2025-09-25 20:19:00,35,,
ProCon,,,https://proconusa.com/,"Their goal was to provide high-quality converting services to merchants, commercial printers and paper mills. Today, ProCon is the largest independent paper converter by market share in the United States and the premier converting & logistics partner",Paper Converting,DuckDuckGo Search,2025-09-25 20:19:00,35,,
Specialty Paper Distributor,,,https://www.papertecinc.com/,"Papertec offers custom paper converting, slitting, sheeting, die-cutting, and specialty films with 85+ years of quality and precision. Request a quote today.",Paper Converting,DuckDuckGo Search,2025-09-25 20:19:00,35,,
South Coast Paper,,,https://www.southcoastpaper.com/,"At South Coast Paper, we specialize in paper converting, roll slitting, rewinding, and sheeting services as well as manufacturing a vast array of paper products and corrugated packaging solutions.",Paper Converting,DuckDuckGo Search,2025-09-25 20:19:00,35,,
Paper Converting Company│Paper Converters,,,https://www.oren-intl.com/,"Oren International is a leading paper converting company for distributors in many industries, including restaurant, industrial, packaging & medical.",Paper Converting,DuckDuckGo Search,2025-09-25 20:19:00,35,,
River Valley Converting,,,https://rivervalleyconverting.com/,"For businesses and manufacturers who require customized solutions, River Valley Converting offers both paper and packaging converting services to fit your needs. You will work directly with our knowledgeable team to convert products to your exact siz",Paper Converting,DuckDuckGo Search,2025-09-25 20:19:00,35,,
"Paper Converting Products and Services, Paper Converting Manufacturer ...",,,https://kraftwrap.com/,"Paper die cutting and paperboard die cutting services for the food service, cosmetics, retail, and other industries. Finishing capabilities include slitting, rewinding, converting, and laminating.",Paper Converting,DuckDuckGo Search,2025-09-25 20:19:00,35,,
Paper Converting Equipment,,,https://www.bretting.com/,Bretting Manufacturing - world-class paper converting equipment supplier. Full lines or machine sections built to your specifications.,Paper Converting,DuckDuckGo Search,2025-09-25 20:19:00,35,,
North America: Paper Converters,,,https://www.paperindex.com/paper-converters-in-north-america/8/12,"We are a Tissue Paper converting company located in Port-au- Prince, Haiti. Our immediate production focus is bath tissue and napkins. View profile Profile recently viewed by buyers from United Arab Emirates, China, United States, Germany, Canada.",Paper Converting,DuckDuckGo Search,2025-09-25 20:19:00,35,,
Contact from https://www.thomasnet.com/suppliers/usa/paper-converters-56901606,sales@adhue.com,862-591-1100,https://www.thomasnet.com/suppliers/usa/paper-converters-56901606,Deep scraped from https://www.thomasnet.com/suppliers/usa/paper-converters-56901606,Paper Converting,Website Deep Scrape,2025-09-25 20:19:09,75,sales@papertec.com,"888-932-8836, 763-781-8072, 607-432-6500"
Contact from https://www.thomasnet.com/suppliers/usa/paper-converters-56901606,sales@papertec.com,862-591-1100,https://www.thomasnet.com/suppliers/usa/paper-converters-56901606,Deep scraped from https://www.thomasnet.com/suppliers/usa/paper-converters-56901606,Paper Converting,Website Deep Scrape,2025-09-25 20:19:09,75,sales@papertec.com,"888-932-8836, 763-781-8072, 607-432-6500"
Contact from https://ctcpaper.com/,orders@ctcpaper.com,(704)485-3212,https://ctcpaper.com/,Deep scraped from https://ctcpaper.com/,Paper Converting,Website Deep Scrape,2025-09-25 20:19:25,75,,"(704) 485-3212, 704-485.3212"
Contact from https://www.paperindex.com/paper-converters-in-united-states/8/9,wecare@paperindex.com,,https://www.paperindex.com/paper-converters-in-united-states/8/9,Deep scraped from https://www.paperindex.com/paper-converters-in-united-states/8/9,Paper Converting,Website Deep Scrape,2025-09-25 20:19:36,75,,
Contact from https://shamrockpaper.com/,orders@shamrockpaper.com,314-241-2370,https://shamrockpaper.com/,Deep scraped from https://shamrockpaper.com/,Paper Converting,Website Deep Scrape,2025-09-25 20:19:46,75,,"314-241-9230, (314) 241-2370"
Contact from https://www.papertecinc.com/,sales@papertecinc.com,888-444-9911,https://www.papertecinc.com/,Deep scraped from https://www.papertecinc.com/,Paper Converting,Website Deep Scrape,2025-09-25 20:20:10,75,,862-591-1103
Contact from https://www.southcoastpaper.com/,info@southcoastpaper.com,803.758.4054,https://www.southcoastpaper.com/,Deep scraped from https://www.southcoastpaper.com/,Paper Converting,Website Deep Scrape,2025-09-25 20:20:19,75,,"609.360.9002, 803-758-4054, 870.361.1942"
