company_name,email,phone,website,snippet,commodity,source,collection_date,data_quality_score,additional_emails,additional_phones
Splendid International USA Corporation,,,https://3smonument.com/,The Premier Supplier For Your Monument - Cemetery Needs Offering standard & custom designs to ensure each and every memorial is truly personal.,Monuments,DuckDuckGo Search,2025-09-18 16:52:30,35,,
Monuments Wholesale — Gaydos Monument Company,,,https://www.gaydosmonument.com/monuments-wholesale,"Gaydos Monument Co. is a wholesale monument supplier of blank and finished granite memorials, and we are the preferred provider of many monument companies, cemeteries and funeral directors across the United states.",Monuments,DuckDuckGo Search,2025-09-18 16:52:30,35,,
Weber Memorials,,,https://www.webermemorials.com/,"Weber Memorials, a St. Cloud, Minnesota-based manufacturer, specializes in importing high-quality granite memorials and monuments. We offer a wide range of both domestic and international colors and can accommodate any design for our wholesale granit",Monuments,DuckDuckGo Search,2025-09-18 16:52:30,35,,
Wholesale Monuments And Imports,,,https://wholesalemonumentsandimports.com/,"Why Choose Us When you choose Wholesale Monuments &Imports, you're choosing a team with there sources, expertise, and passion to bring your vision to reality.",Monuments,DuckDuckGo Search,2025-09-18 16:52:30,35,,
Wholesale Granite Monument Suppliers,,,https://www.kattima.com/monuments/,"Wholesale Granite Monument Suppliers 50,000 Cubic Feet of wholesale granite monuments supplied in 2021, to customers in the USA (From NJ, NY to the Mid-West to West Coast California) & Canada. 40+ Years' experience and expertise in the wholesale gran",Monuments,DuckDuckGo Search,2025-09-18 16:52:30,35,,
Premier Wholesale Supplier of Granite Monuments,,,https://stonemanworks.com/,"Stoneman Works is your premier wholesale supplier for high quality granite monuments. With competitive pricing, efficient logistics, and a commitment to quality, we deliver excellence every time.",Monuments,DuckDuckGo Search,2025-09-18 16:52:30,35,,
Monument Depot,,,https://monumentdepot.com/,"Monument Depot Inc. is a Markham based importer, wholesaler and retailer of high quality and affordable granite monuments and memorials. They ensure that any product sold under the Monument Depot banner is made with the finest of materials and the ve",Monuments,DuckDuckGo Search,2025-09-18 16:52:30,35,,
Contact from https://www.kanigranites.com/,sales@kanigranites.com,(347) 421-1861,https://www.kanigranites.com/,Deep scraped from https://www.kanigranites.com/,Monuments,Website Deep Scrape,2025-09-18 16:52:38,75,kanigranite@gmail.com,"(844) 526-4462, (347) 438-3363"
Contact from https://www.kanigranites.com/,kanigranite@gmail.com,(347) 421-1861,https://www.kanigranites.com/,Deep scraped from https://www.kanigranites.com/,Monuments,Website Deep Scrape,2025-09-18 16:52:38,75,kanigranite@gmail.com,"(844) 526-4462, (347) 438-3363"
Contact from https://www.coldspringusa.com/,info@coldspringusa.com,800.328.5040,https://www.coldspringusa.com/,Deep scraped from https://www.coldspringusa.com/,Monuments,Website Deep Scrape,2025-09-18 16:52:50,75,,
Contact from https://www.salemstones.com/,patricko@salemstones.com,678.921.5800,https://www.salemstones.com/,Deep scraped from https://www.salemstones.com/,Monuments,Website Deep Scrape,2025-09-18 16:53:03,75,"customdesign@salemstones.com, nreynolds@salemstones.com, leighs@salemstones.com, katief@salemstones.com, ryane@salemstones.com, info@salemstones.com, paulm@salemstones.com, support@salemstones.com","614.629.9110, 614.565.6473, 614.526.1515, 614.965.1555, (866) 834-1219, 614.202.1688, (866) 400-1289"
Contact from https://www.salemstones.com/,customdesign@salemstones.com,678.921.5800,https://www.salemstones.com/,Deep scraped from https://www.salemstones.com/,Monuments,Website Deep Scrape,2025-09-18 16:53:03,75,"customdesign@salemstones.com, nreynolds@salemstones.com, leighs@salemstones.com, katief@salemstones.com, ryane@salemstones.com, info@salemstones.com, paulm@salemstones.com, support@salemstones.com","614.629.9110, 614.565.6473, 614.526.1515, 614.965.1555, (866) 834-1219, 614.202.1688, (866) 400-1289"
Contact from https://www.salemstones.com/,nreynolds@salemstones.com,678.921.5800,https://www.salemstones.com/,Deep scraped from https://www.salemstones.com/,Monuments,Website Deep Scrape,2025-09-18 16:53:03,75,"customdesign@salemstones.com, nreynolds@salemstones.com, leighs@salemstones.com, katief@salemstones.com, ryane@salemstones.com, info@salemstones.com, paulm@salemstones.com, support@salemstones.com","614.629.9110, 614.565.6473, 614.526.1515, 614.965.1555, (866) 834-1219, 614.202.1688, (866) 400-1289"
Contact from https://3smonument.com/,victor@3ssplendidintl.com,253.508.7142,https://3smonument.com/,Deep scraped from https://3smonument.com/,Monuments,Website Deep Scrape,2025-09-18 16:53:09,75,,206.245.0066
Contact from https://www.gaydosmonument.com/monuments-wholesale,info@gaydosgranite.com,866-442-9367,https://www.gaydosmonument.com/monuments-wholesale,Deep scraped from https://www.gaydosmonument.com/monuments-wholesale,Monuments,Website Deep Scrape,2025-09-18 16:53:21,75,,"724-745-6117, 724-745-4413"
Contact from https://www.webermemorials.com/,info@webermemorials.comJoin,(877) 258-4711,https://www.webermemorials.com/,Deep scraped from https://www.webermemorials.com/,Monuments,Website Deep Scrape,2025-09-18 16:53:29,75,,"(800) 328-2303, (320) 258-4711, (320) 258-4706, (320) 258 4711"
Contact from https://www.kattima.com/monuments/,enquiry@kattima.com,9144283635,https://www.kattima.com/monuments/,Deep scraped from https://www.kattima.com/monuments/,Monuments,Website Deep Scrape,2025-09-18 16:53:44,75,,"+91-9003071883, 9003071883, +914428363545, +91-4428363545, 4428363545"
"Welcome to CT Commercial Paper, LLC",,,https://ctcpaper.com/,dedication and commitment to consistantly deliver professional excellence in products and services to all of our clients throughout to USA. This dedication and commitment has provided us with the knowledge and expertise that extends in to every aspec,Paper Converting,DuckDuckGo Search,2025-09-18 16:55:50,35,,
Paper Converting Services Suppliers,,,https://www.thomasnet.com/suppliers/usa/paper-converters-56901606,Paper Converting Services Suppliers Welcome to this comprehensive resource for Paper Converting Services Suppliers and Manufacturers on Thomas. Here you can find any Paper Converting Services Suppliers that suits your needs. If Ownership Diversity is,Paper Converting,DuckDuckGo Search,2025-09-18 16:55:50,35,,
"Paper Converting Products and Services, Paper Converting Manufacturer ...",,,https://kraftwrap.com/,"Paper die cutting and paperboard die cutting services for the food service, cosmetics, retail, and other industries. Finishing capabilities include slitting, rewinding, converting, and laminating.",Paper Converting,DuckDuckGo Search,2025-09-18 16:55:50,35,,
United States: Paper Converters,,,https://www.paperindex.com/paper-converters-in-united-states/8/9,"Sullivan Paper Co., Inc. is located in West Springfield, Massachusetts, USA. We are a Rotogravure and Flexographic Gift Wrap and Box Wrap Printer and Converter that have been supplying this trade... View profile Profile recently viewed by buyers from",Paper Converting,DuckDuckGo Search,2025-09-18 16:55:50,35,,
ProCon,,,https://proconusa.com/,"Their goal was to provide high-quality converting services to merchants, commercial printers and paper mills. Today, ProCon is the largest independent paper converter by market share in the United States and the premier converting & logistics partner",Paper Converting,DuckDuckGo Search,2025-09-18 16:55:50,35,,
Price Paper,,,https://www.price-paper.com/,"We are a leading industrial packaging, food service and bakery paper converter for wholesalers and distributors in Southern California and across the U.S. We specialize in paper converting, roll slitting, rewinding, sheeting, cutting and die-cutting.",Paper Converting,DuckDuckGo Search,2025-09-18 16:55:50,35,,
Paper Converting Company│Paper Converters,,,https://www.oren-intl.com/,"Oren International is a leading paper converting company for distributors in many industries, including restaurant, industrial, packaging & medical.",Paper Converting,DuckDuckGo Search,2025-09-18 16:55:50,35,,
Specialty Paper Distributor,,,https://www.papertecinc.com/,"Papertec offers custom paper converting, slitting, sheeting, die-cutting, and specialty films with 85+ years of quality and precision. Request a quote today.",Paper Converting,DuckDuckGo Search,2025-09-18 16:55:50,35,,
River Valley Converting,,,https://rivervalleyconverting.com/,"For businesses and manufacturers who require customized solutions, River Valley Converting offers both paper and packaging converting services to fit your needs. You will work directly with our knowledgeable team to convert products to your exact siz",Paper Converting,DuckDuckGo Search,2025-09-18 16:55:50,35,,
STRONG PAPER,,,https://www.strongconverting.com/,Strong Converting specializes in converting mill rolls of packaging-grade and food grade paper and protective films into usable-size rolls and sheets for the industrial packaging market.,Paper Converting,DuckDuckGo Search,2025-09-18 16:55:50,35,,
Contact from https://ctcpaper.com/,orders@ctcpaper.com,(704)485-3212,https://ctcpaper.com/,Deep scraped from https://ctcpaper.com/,Paper Converting,Website Deep Scrape,2025-09-18 16:55:55,75,,"704-485.3212, (704) 485-3212"
Contact from https://www.thomasnet.com/suppliers/usa/paper-converters-56901606,sales@papertec.com,888-932-8836,https://www.thomasnet.com/suppliers/usa/paper-converters-56901606,Deep scraped from https://www.thomasnet.com/suppliers/usa/paper-converters-56901606,Paper Converting,Website Deep Scrape,2025-09-18 16:56:06,75,sales@adhue.com,"607-432-6500, 862-591-1100, 763-781-8072"
Contact from https://www.thomasnet.com/suppliers/usa/paper-converters-56901606,sales@adhue.com,888-932-8836,https://www.thomasnet.com/suppliers/usa/paper-converters-56901606,Deep scraped from https://www.thomasnet.com/suppliers/usa/paper-converters-56901606,Paper Converting,Website Deep Scrape,2025-09-18 16:56:06,75,sales@adhue.com,"607-432-6500, 862-591-1100, 763-781-8072"
Contact from https://www.oren-intl.com/,info@oren-intl.com,850.433.6777,https://www.oren-intl.com/,Deep scraped from https://www.oren-intl.com/,Paper Converting,Website Deep Scrape,2025-09-18 16:57:10,75,,850.433.9080
Contact from https://www.papertecinc.com/,sales@papertecinc.com,888-444-9911,https://www.papertecinc.com/,Deep scraped from https://www.papertecinc.com/,Paper Converting,Website Deep Scrape,2025-09-18 16:57:22,75,,862-591-1103
11+ Top Pet Food Manufacturers in the U.S.,,,https://partnerslate.com/learningcenter/pet-food-manufacturers/,"For many new and existing pet food companies, it takes time to find the right co-manufacturer or co-packer for your brand. It's critical to work with a pet food manufacturer that sources quality ingredients, offers the required processing and packagi",Pet Food Manufacturer,DuckDuckGo Search,2025-09-18 16:58:12,35,,
Pet Food Manufacturer,,,https://barrettpetfood.com/,"Located in the heart of central Minnesota, Barrett Petfood develops super premium pet food diets from emerging brands to market leaders in the industry. Our family-owned, nimble execution and continuous innovation takes pet food manufacturing, packag",Pet Food Manufacturer,DuckDuckGo Search,2025-09-18 16:58:12,35,,
Top 100 Pet Food Companies in United States (2025),,,https://ensun.io/search/pet-food/united-states,"Top Pet Food Companies in United States The B2B platform for the best purchasing descision. Identify and compare relevant B2B manufacturers, suppliers and retailers Supplier discovery Consumer Goods Fast Moving Consumer Goods Pet Food Close Filter Re",Pet Food Manufacturer,DuckDuckGo Search,2025-09-18 16:58:12,35,,
"Cat, Dog & Pet Foods Manufacturers and Suppliers in the USA ...",,,https://www.thomasnet.com/suppliers/usa/cat-dog-pet-foods-96026257,"Custom manufacturer of food product including cookies, pet treats, protein bites, nutrition bars, cheese crisps, and puffs. Tub, flow wrapped, and pouched cookies are offered.",Pet Food Manufacturer,DuckDuckGo Search,2025-09-18 16:58:12,35,,
20 Largest Pet Food Manufacturers in the US (Updated 2025),,,https://articles.hepper.com/largest-pet-food-manufacturers-in-us/,Find out all about the 20 largest pet food manufacturers in the US and whether or not their brand is right for you and your pup.,Pet Food Manufacturer,DuckDuckGo Search,2025-09-18 16:58:12,35,,
Alive Natural Pet Food Manufacturer of High Quality Meat Products ...,info@alivepetfood.com,,https://alivepetfood.com/,"Alive, LLC was established in 2010 by a management and production team with more than 25 years of extensive FDA and USDA food processing experience. Co-Packing & Distribution An experienced manufacturer of high quality meat products that fulfills you",Pet Food Manufacturer,DuckDuckGo Search,2025-09-18 16:58:12,80,,
Pet Food & Treat Manufacturers For B2B,,,https://multilinkcorp.com/pet-products/,"Trusted pet food and treat manufacturers for B2B in the usa. We provide high-quality, wholesale pet food & treats for retailers, distributors, & private labels. Partner with us today!",Pet Food Manufacturer,DuckDuckGo Search,2025-09-18 16:58:12,35,,
Pet Product Contract Manufacturer,,,https://www.petdinellc.com/,"Leading pet product contract manufacturer offering partnership services with custom and wholesale pet supplements, treats, and food for cats and dogs.",Pet Food Manufacturer,DuckDuckGo Search,2025-09-18 16:58:12,35,,
Pet Food and Supplies Manufacturers and Wholesalers,,,https://mfg.regionaldirectory.us/pet-food-and-supplies/,"Pet food is animal feed that is intended for consumption by pets. Pet foods generally consist of meat, meat byproducts, cereals, grain, vitamins, and minerals. This Pet Food & Supplies manufacturer and distributor directory includes pet food manufact",Pet Food Manufacturer,DuckDuckGo Search,2025-09-18 16:58:12,35,,
Home,,,https://dfpetfood.com/,"At DF Pet Food, we specialize in OEM and private label manufacturing of premium pet food for global brands. From custom wet food recipes to functional treats, our team ensures your product is safe, nutritious, and export-ready. We support pet startup",Pet Food Manufacturer,DuckDuckGo Search,2025-09-18 16:58:12,35,,
United States Pet Products Manufacturers & Suppliers,,,https://www.petsglobal.com/manufacturers/default_country=3.html,"PetsGlobal.com provides United States Pet Products , United States Pet Products Manufacturers, United States Pet Products Suppliers, United States Pet Products Agent, United States Pet Products Companies and more.",Pet Food Manufacturer,DuckDuckGo Search,2025-09-18 16:58:12,35,,
Alphia,,,https://www.alphia.com/,"Alphia is a full-service private-label pet food manufacturer. Capabilities include bagged & canned food, treats & more. All operations in US.",Pet Food Manufacturer,DuckDuckGo Search,2025-09-18 16:58:12,35,,
Pet Food Ingredient Supplier,,,https://www.northcentralco.com/industry/pet-food-ingredients/,"At North Central Companies, we believe pets should be treated as well as any other member of the family. That's why, as leading pet food ingredient supplier in the United States, we're committed to helping pet food manufacturers of all sizes source t",Pet Food Manufacturer,DuckDuckGo Search,2025-09-18 16:58:12,35,,
Best Wholesale Pet Food & Products Supplier USA,,,https://statewideservicecenter.com/,We are a leading distributor of wholesale pet food suppliers & precision pet products in the USA. We offer original pet food products at an amazing prices. Visit us today!,Pet Food Manufacturer,DuckDuckGo Search,2025-09-18 16:58:12,35,,
9 Best American Pet Food Manufacturers,,,https://usetorg.com/category/american-pet-food,"Our American Pet Food suppliers adhere to rigorous quality standards, ensuring compliance with AAFCO, USDA, and FDA regulations. Whether you're sourcing private label products, buying in bulk, or seeking contract manufacturing solutions, our network ",Pet Food Manufacturer,DuckDuckGo Search,2025-09-18 16:58:12,35,,
Contact from https://partnerslate.com/learningcenter/pet-food-manufacturers/,1-888-290-7606info@eurocanpetproducts.com,888-290-7606,https://partnerslate.com/learningcenter/pet-food-manufacturers/,Deep scraped from https://partnerslate.com/learningcenter/pet-food-manufacturers/,Pet Food Manufacturer,Website Deep Scrape,2025-09-18 16:58:19,75,,
Contact from https://ensun.io/search/pet-food/united-states,info@ensun.de,+49 271 3388120,https://ensun.io/search/pet-food/united-states,Deep scraped from https://ensun.io/search/pet-food/united-states,Pet Food Manufacturer,Website Deep Scrape,2025-09-18 16:58:35,75,,271 3388120
Contact from https://alivepetfood.com/,info@alivepetfood.com,507.932.6880,https://alivepetfood.com/,Deep scraped from https://alivepetfood.com/,Pet Food Manufacturer,Website Deep Scrape,2025-09-18 16:58:56,75,,866.967.0152
Contact from https://www.petdinellc.com/,info@petdine.com,970.692.6134,https://www.petdinellc.com/,Deep scraped from https://www.petdinellc.com/,Pet Food Manufacturer,Website Deep Scrape,2025-09-18 16:59:28,75,justin.boling@petdine.com,833-273-8346
Contact from https://www.petdinellc.com/,justin.boling@petdine.com,970.692.6134,https://www.petdinellc.com/,Deep scraped from https://www.petdinellc.com/,Pet Food Manufacturer,Website Deep Scrape,2025-09-18 16:59:28,75,justin.boling@petdine.com,833-273-8346
Majestic Steel USA,,,https://www.majesticsteel.com/,"Right Steel. Right Solutions. Right Timing. Majestic stocks prime flat rolled steel sourced from all qualified domestic and fair-trade suppliers. Processed to meet your needs, we offer standard stock coils and sheets as well as custom sizes made to o",Sheet Metal,DuckDuckGo Search,2025-09-18 17:01:46,35,,
Sheet Metals Suppliers,,,https://www.thomasnet.com/suppliers/usa/sheet-metals-50821800,"Distributor* , Custom Manufacturer, Finishing Service Company, Manufacturer, Service Company ⚫ $10 - 24.9 Mil Revenue ⚫ Est. 1984 Distributor of prefinished clad metals for aerospace, automotive, medical, marine, military, petrochemical, and construc",Sheet Metal,DuckDuckGo Search,2025-09-18 17:01:46,35,,
Industrial Metal Supply Co.,,,https://www.industrialmetalsupply.com/,"Trusted Metal Supplier with Decades of Metal Expertise Industrial Metal Supply stocks a broad range of metal materials, including aluminum, steel, stainless steel, copper and brass, and specialty metals. We also provide other services, including lase",Sheet Metal,DuckDuckGo Search,2025-09-18 17:01:46,35,,
Sheet Metal Contract Manufacturing & Assembly,,,https://www.dalsinind.com/,Dalsin Industries is positioned as a full-service contract manufacturer with major OEM customers across the United States. Dalsin leads the market in high-value contract manufacturing of precision sheet metal products--delivering operation excellence,Sheet Metal,DuckDuckGo Search,2025-09-18 17:01:46,35,,
Continental Steel & Tube: Metal Supplier & Distributor,,,https://continentalsteel.com/,"Continental Steel & Tube Company is a Titanium, Stainless Steel, Nickel, Steel, Aluminum, Brass and Bronze Value Added Volume Metals Supplier & Distributor.",Sheet Metal,DuckDuckGo Search,2025-09-18 17:01:46,35,,
Metal Supplier USA,,,https://www.norfolkiron.com/,Norfolk Iron & Metal is one of the nation's largest metal suppliers. We always stay true to what got us here: hard work and customer service.,Sheet Metal,DuckDuckGo Search,2025-09-18 17:01:46,35,,
Sheet Metal Fabrication,,,https://www.cadrex.com/sheet-metal-fabrication,"We have decades of experience designing and building sheet metal parts, sheet metal assembly, and integrated products for Fortune 500 companies. Our team of experienced engineers, designers, and manufacturers becomes an extension of our customers.",Sheet Metal,DuckDuckGo Search,2025-09-18 17:01:46,35,,
Aluminum Alloy and Sheet Metal Distributors,,,https://www.adimetal.com/,"ADI Metal specializes in aluminum alloys for marine, industrial, and government needs. We provide top-tier materials and solutions. Contact us today!",Sheet Metal,DuckDuckGo Search,2025-09-18 17:01:46,35,,
Sheet Metal Manufacturers and Wholesalers,,,https://mfg.regionaldirectory.us/sheet-metal/,"Sheet metal is often used in metalworking processes because it can be cut and bent into various shapes. This Sheet Metal manufacturer and distributor directory includes sheet metal manufacturer web pages for every State in the USA plus Washington, DC",Sheet Metal,DuckDuckGo Search,2025-09-18 17:01:46,35,,
Online Metals Supplier,,,https://www.ryerson.com/,"Ryerson is an online metal supplier, metal processor and distributor, offering more than 65,000 varieties of stainless, aluminum, carbon and alloys in all shapes and sizes.",Sheet Metal,DuckDuckGo Search,2025-09-18 17:01:46,35,,
Contact from https://www.majesticsteel.com/,press@majesticsteel.com,800.321.5590,https://www.majesticsteel.com/,Deep scraped from https://www.majesticsteel.com/,Sheet Metal,Website Deep Scrape,2025-09-18 17:01:53,75,,"440.786.2666, 440.786.0576"
Contact from https://continentalsteel.com/,Sales@ContinentalSteel.com,855.954.5086,https://continentalsteel.com/,Deep scraped from https://continentalsteel.com/,Sheet Metal,Website Deep Scrape,2025-09-18 17:02:50,75,,"954.332.2290, +1-954-332-2290, 954-332-2290, 855-954-5086, (954) 332-2290, 954-332-2296"
Contact from https://www.adimetal.com/,sales@adimetal.com,866.825.9271,https://www.adimetal.com/,Deep scraped from https://www.adimetal.com/,Sheet Metal,Website Deep Scrape,2025-09-18 17:03:23,75,,"+1 954.779.7355, 954.523.6474, +1 954.523.6474, 954.779.7355"
Metals USA,,,https://www.metalsusa.com/,"Metals USA is a leading supplier of processed carbon steel, stainless steel, and manufactured metal components with service centers throughout the United States.","Steel, Metal Fabrication",DuckDuckGo Search,2025-09-18 17:04:08,35,,
Top 21 Metal Manufacturing Companies in the US,,,https://www.inven.ai/company-lists/top-21-metal-manufacturing-companies-in-the-us,"Discover the top metal manufacturing companies in the US, including Steel Technologies and Ulbrich Stainless Steels, providing essential materials for various industries.","Steel, Metal Fabrication",DuckDuckGo Search,2025-09-18 17:04:08,35,,
Top 11 USA Metal Supplier & Manufacturers in 2025,,,https://www.linquip.com/blog/usa-metal-supplier-manufacturers/,"USA Metal Supplier & Manufacturers in 2025 - Most manufactured items need some kind of metal part to act as a support, cage, framework, or enclosure.","Steel, Metal Fabrication",DuckDuckGo Search,2025-09-18 17:04:08,35,,
Home,,,https://www.metalsales.us.com/,"With over 60 years of experience, Metal Sales is the nation's largest manufacturer of metal roofing, wall, and building systems. We are the most awarded and highly recognized provider of metal fabrication materials.","Steel, Metal Fabrication",DuckDuckGo Search,2025-09-18 17:04:08,35,,
Metal Supplier USA,,,https://www.norfolkiron.com/,Norfolk Iron & Metal is one of the nation's largest metal suppliers. We always stay true to what got us here: hard work and customer service.,"Steel, Metal Fabrication",DuckDuckGo Search,2025-09-18 17:04:08,35,,
Sheet Metal Contract Manufacturing & Assembly,,,https://www.dalsinind.com/,"With an outstanding history of innovation, quality, and ISO 9001 Certified Quality Management Systems, Dalsin Offers best-in-class contract metal manufacturing & assembly capabilities. By combining design-for-manufacture optimization, collaborative d","Steel, Metal Fabrication",DuckDuckGo Search,2025-09-18 17:04:08,35,,
Welcome to North American Metal Services,,,https://nametalservices.com/,"NA Metal Services is committed to cultivating relationships between OEM's and suppliers. We assist OEMs in both new product and new market development for their metal parts. Whether you are looking for a turnkey solution, individual component manufac","Steel, Metal Fabrication",DuckDuckGo Search,2025-09-18 17:04:08,35,,
Metal Forming Manufacturing,,,https://www.compass-anvil.com/,High-Quality Metal Forming Manufacturer Sourcing Compass & Anvil is your global sourcing authority for securing quality metal components and products from trusted manufacturers across the United States and China. We can facilitate the process of secu,"Steel, Metal Fabrication",DuckDuckGo Search,2025-09-18 17:04:08,35,,
"Custom Metal Fabrication, Processing, and Distribution",,,https://metrosteelusa.com/,"Providing partners with heavy fabrication, original equipment manufacturing, value-added services, large structural projects, and steel distribution. Metro Steel USA is a leader in heavy metal manufacturing and laser precision fabrication for steel, ","Steel, Metal Fabrication",DuckDuckGo Search,2025-09-18 17:04:08,35,,
Tendon Manufacturing,,,https://www.tendon.com/,"Transforming Metal Fabrication with Robotics Tendon Manufacturing's advanced Robotics deliver precision, speed, and USA-made quality you can trust. From aerospace to automotive, our automated solutions reduce costs, eliminate errors, and accelerate p","Steel, Metal Fabrication",DuckDuckGo Search,2025-09-18 17:04:08,35,,
