company_name,email,phone,website,snippet,commodity,source,collection_date,data_quality_score,additional_emails,additional_phones
Foam Suppliers,,,https://gotfoaminsulation.com/resources/foam-suppliers,"DEMILEC (USA) LLC is one of the pioneers in the development and commercialization of the totally water blown environmentally friendly spray foam insulation, SEALECTION 500, and other spray foam systems, such as HEATLOK (rigid, closed cells) which use",Foam Insulation,DuckDuckGo Search,2025-09-25 20:05:52,35,,
Tiger Foam,,,https://tigerfoam.com/customers/distribution/,"For instance, metal building erectors and distributors can offer Tiger Foam™ as part of an ""insulation upgrade package"" and give their customers the option of paying, for instance, $22,000 for a building kit that includes fiberglass insulation system",Foam Insulation,DuckDuckGo Search,2025-09-25 20:05:52,35,,
Foam Manufacturers and Suppliers in the USA,,,https://www.thomasnet.com/articles/top-suppliers/foam-manufacturers-and-suppliers/,"Find a list of the top featured foam manufacturers and suppliers on Thomas, as well as the top foam suppliers in the USA by revenue.",Foam Insulation,DuckDuckGo Search,2025-09-25 20:05:52,35,,
Foam Insulation Manufacturers and Suppliers in the USA and Canada,,,https://www.thomasnet.com/suppliers/usa/foam-insulation-40980609?coverage_area=NA,"Custom manufacturer of foam insulation made from polyethylene, polyurethane, and expanded polystyrene. Serves the aerospace, defense, cosmetics, personal care, beverage, wine, electronics, E-commerce, food, medical, and retail industries.",Foam Insulation,DuckDuckGo Search,2025-09-25 20:05:52,35,,
Wholesale Spray Foam Insulation Suppliers,,,https://www.idi-insulation.com/,"IDI: Insulation Distributors Inc. is Americas wholesale spray foam insulation supplier. We offer next day delivery, trainings, expertise and more. Learn more about IDI.",Foam Insulation,DuckDuckGo Search,2025-09-25 20:05:52,35,,
Foam Products Corporation,,,https://www.fpcfoam.com/,"Foam Products Corporation is a leading fabricator and distributor of commercial and industrial foam insulation and packaging products. We provide full integration of design, quality, manufacturing, and unparalleled customer service to bring you one o",Foam Insulation,DuckDuckGo Search,2025-09-25 20:05:52,35,,
Wholesale Spray Foam Insulation Suppliers Omaha NE,,,https://www.idi-insulation.com/location/omaha-ne/,"Custom Spray Foam Insulation Rigs in Omaha, NE Are you looking for a new spray foam insulation rig or equipment for your Omaha area business? IDI carries custom spray foam insulation rigs for both residential and commercial projects to help your busi",Foam Insulation,DuckDuckGo Search,2025-09-25 20:05:52,35,,
Top 100 Foam Manufacturers in United States (2025),,,https://ensun.io/search/foam/united-states,"Discover all relevant Foam Manufacturers in United States, including Creative Foam Corp and Foam Holdings Inc.",Foam Insulation,DuckDuckGo Search,2025-09-25 20:05:52,35,,
Foam-In-Place Insulation Manufacturers and Suppliers in the USA and Canada,,,https://www.thomasnet.com/suppliers/usa/foaminplace-insulation-40980807?WT.mc_n=y,"Manufacturer & distributor of acoustical foam-in-place for insulation against noise, sound, heat & cold. Polyethylene energy- & moisture-absorbing Ethafoam for fabrication with conventional cutting tools & by hot-wire forming.",Foam Insulation,DuckDuckGo Search,2025-09-25 20:05:52,35,,
Insulation Supplies,,,https://www.insulationsupplies.com/,"Insulation Materials for Residential or Commercial Needs Insulation Supplies is a specialty distributor located in New Hope, Minnesota. We have been selling insulation products to commercial and residential customers since 1986. We pride ourselves on",Foam Insulation,DuckDuckGo Search,2025-09-25 20:05:52,35,,
Contact from https://gotfoaminsulation.com/resources/foam-suppliers,60007foam@gotfoaminsulation.com,+1 847 454 9081,https://gotfoaminsulation.com/resources/foam-suppliers,Deep scraped from https://gotfoaminsulation.com/resources/foam-suppliers,Foam Insulation,Website Deep Scrape,2025-09-25 20:05:58,75,,"847 454 9081, +1 847 454 9620, 847 454 9620"
Contact from https://tigerfoam.com/customers/distribution/,customerservice@tigerfoam.com,+1 732-927-2091,https://tigerfoam.com/customers/distribution/,Deep scraped from https://tigerfoam.com/customers/distribution/,Foam Insulation,Website Deep Scrape,2025-09-25 20:06:18,75,,"732-927-2091, +1 732-927-2090, 732-927-2090, 800-664-0063"
Contact from https://www.idi-insulation.com/location/omaha-ne/,OMAorders@idimn.com,888.843.1318,https://www.idi-insulation.com/location/omaha-ne/,Deep scraped from https://www.idi-insulation.com/location/omaha-ne/,Foam Insulation,Website Deep Scrape,2025-09-25 20:07:17,75,,531.484.4752
Contact from https://ensun.io/search/foam/united-states,info@ensun.de,271 3388120,https://ensun.io/search/foam/united-states,Deep scraped from https://ensun.io/search/foam/united-states,Foam Insulation,Website Deep Scrape,2025-09-25 20:07:26,75,,+49 271 3388120
Frozen Bakery Manufacturers Suppliers Processors USA,,,https://www.frozen-goods.com/frozen-bakery-manufacturers-suppliers-processors-usa/,"Frozen Bakery Manufacturers Suppliers Processors USA On this page you'll find a list and contact information of frozen Bakery & Pastry suppliers, manufacturers, processors, specialists, importers, traders, wholesalers and distributors of IQF Frozen B",Frozen Bakery Products,DuckDuckGo Search,2025-09-25 20:08:10,35,,
Frozen Bakery Products,,,https://allroundfoods.com/,Please contact us and we will ship it to you immediately free of charge! See why fresh frozen bakery products are the best solution if you demand consistent high quality for your bakery goods.,Frozen Bakery Products,DuckDuckGo Search,2025-09-25 20:08:10,35,,
National Sales,,,https://www.franzbakery.com/HTML/nationalSales,"Trust us with your product specifications. We can provide fresh or frozen products designed to meet the needs of national retailers, food service distributors, food processing companies, and proprietary formulations. If you are looking for a bakery s",Frozen Bakery Products,DuckDuckGo Search,2025-09-25 20:08:10,35,,
Bakery Manufacturer and Distributor,,,https://bakemark.com/,"Your Trusted Bakery Manufacturing & Distribution Partner Along with the resources and knowledge of the largest global bakery manufacturer and distributors in North America, BakeMark brings you a wide range of high-quality products and ingredients — i",Frozen Bakery Products,DuckDuckGo Search,2025-09-25 20:08:10,35,,
Baked Goods Manufacturers and Suppliers in the USA and Canada,,,https://www.thomasnet.com/suppliers/usa/baked-goods-96034368,"Contract manufacturer of private label baked goods. Cakes, gluten free cookies, crisps, and baked bars are offered. Powders, mixes, and non-baked food products are also available. Research and development, quality control, ingredients sourcing, and w",Frozen Bakery Products,DuckDuckGo Search,2025-09-25 20:08:10,35,,
Rich's USA,,,https://www.richsusa.com/,Rich's USA provides an unmatched portfolio of innovative food products to foodservice operators and in-store bakeries across the nation.,Frozen Bakery Products,DuckDuckGo Search,2025-09-25 20:08:10,35,,
Frozen Bakery Manufacturers in Usa,,,https://www.frozenb2b.com/category-supplier/frozen-bakery/?_suppliers_country=usa,"We do have a supplier in the world wide, wherever you are. Suppliers can offer you a wide choices of Frozen Bakery to your company. You can refine your search by product category or by country to get contact details and information.",Frozen Bakery Products,DuckDuckGo Search,2025-09-25 20:08:10,35,,
"Top 10 United States Frozen Bakery Product Manufacturers, Companies ...",,,https://www.credenceresearch.com/news/top-10-united-states-frozen-bakery-product-manufacturers-companies-market-snapshot,"J&J Snack Foods Corp. is a leading manufacturer and distributor of niche snack foods and beverages in the United States, with a significant presence in the frozen food and bakery sector.",Frozen Bakery Products,DuckDuckGo Search,2025-09-25 20:08:10,35,,
Schulstad Bakery Solutions,,,https://www.schulstadbakerysolutions.us/,"Schulstad Bakery Solutions is a wholesale bakery and Danish pastry supplier specializing in frozen pre-proofed, ready-to-bake pastries, croissants, and more.",Frozen Bakery Products,DuckDuckGo Search,2025-09-25 20:08:10,35,,
CraftMark Bakery,,,https://www.craftmarkbakery.com/,"We manufacture delicious sweet and savory snacks for the Foodservice and In-Store Bakery ISB markets, including thaw and sell individually-wrapped cookies, pre-deposited muffin batter, frozen pre-portioned cookie dough, freezer to oven sandwich carri",Frozen Bakery Products,DuckDuckGo Search,2025-09-25 20:08:10,35,,
Contact from https://www.frozen-goods.com/frozen-bakery-manufacturers-suppliers-processors-usa/,info@craftmarkbakery.com,(516) 326 9288,https://www.frozen-goods.com/frozen-bakery-manufacturers-suppliers-processors-usa/,Deep scraped from https://www.frozen-goods.com/frozen-bakery-manufacturers-suppliers-processors-usa/,Frozen Bakery Products,Website Deep Scrape,2025-09-25 20:08:17,75,"bagelmail@aandsbagels.com, jimroden@bethco.com, info@dufourpastrykitchens.com, info@amorosobaking.com","+1 (516) 326 9288, 609 894 2363, +1 203 791 1389, +1 609 894 2207, 877 241 6161, +1 (315) 986 9999, +1 800 439 1282, +1 (773) 261 6000, +1 203 790 6940, (317) 548 3929, +1 (317) 548 3929, (773) 261 6000, +1 215 471 4740, +1 609 894 2363, 609 894 2207, 203 790 6940, 203 791 1389, 800 439 1282, (315) 986 7200, +1 877 241 6161, 215 471 4740, (315) 986 9999, +1 (315) 986 7200"
Contact from https://www.frozen-goods.com/frozen-bakery-manufacturers-suppliers-processors-usa/,bagelmail@aandsbagels.com,(516) 326 9288,https://www.frozen-goods.com/frozen-bakery-manufacturers-suppliers-processors-usa/,Deep scraped from https://www.frozen-goods.com/frozen-bakery-manufacturers-suppliers-processors-usa/,Frozen Bakery Products,Website Deep Scrape,2025-09-25 20:08:17,75,"bagelmail@aandsbagels.com, jimroden@bethco.com, info@dufourpastrykitchens.com, info@amorosobaking.com","+1 (516) 326 9288, 609 894 2363, +1 203 791 1389, +1 609 894 2207, 877 241 6161, +1 (315) 986 9999, +1 800 439 1282, +1 (773) 261 6000, +1 203 790 6940, (317) 548 3929, +1 (317) 548 3929, (773) 261 6000, +1 215 471 4740, +1 609 894 2363, 609 894 2207, 203 790 6940, 203 791 1389, 800 439 1282, (315) 986 7200, +1 877 241 6161, 215 471 4740, (315) 986 9999, +1 (315) 986 7200"
Contact from https://www.frozen-goods.com/frozen-bakery-manufacturers-suppliers-processors-usa/,jimroden@bethco.com,(516) 326 9288,https://www.frozen-goods.com/frozen-bakery-manufacturers-suppliers-processors-usa/,Deep scraped from https://www.frozen-goods.com/frozen-bakery-manufacturers-suppliers-processors-usa/,Frozen Bakery Products,Website Deep Scrape,2025-09-25 20:08:17,75,"bagelmail@aandsbagels.com, jimroden@bethco.com, info@dufourpastrykitchens.com, info@amorosobaking.com","+1 (516) 326 9288, 609 894 2363, +1 203 791 1389, +1 609 894 2207, 877 241 6161, +1 (315) 986 9999, +1 800 439 1282, +1 (773) 261 6000, +1 203 790 6940, (317) 548 3929, +1 (317) 548 3929, (773) 261 6000, +1 215 471 4740, +1 609 894 2363, 609 894 2207, 203 790 6940, 203 791 1389, 800 439 1282, (315) 986 7200, +1 877 241 6161, 215 471 4740, (315) 986 9999, +1 (315) 986 7200"
Contact from https://allroundfoods.com/,customerservice@allroundfoods.com,516-338-5151,https://allroundfoods.com/,Deep scraped from https://allroundfoods.com/,Frozen Bakery Products,Website Deep Scrape,2025-09-25 20:08:27,75,"CustomerService@AllRoundFoods.com, 1-800-428-8802customerservice@allroundfoods.com",800-428-8802
Contact from https://allroundfoods.com/,CustomerService@AllRoundFoods.com,516-338-5151,https://allroundfoods.com/,Deep scraped from https://allroundfoods.com/,Frozen Bakery Products,Website Deep Scrape,2025-09-25 20:08:27,75,"CustomerService@AllRoundFoods.com, 1-800-428-8802customerservice@allroundfoods.com",800-428-8802
Contact from https://allroundfoods.com/,1-800-428-8802customerservice@allroundfoods.com,516-338-5151,https://allroundfoods.com/,Deep scraped from https://allroundfoods.com/,Frozen Bakery Products,Website Deep Scrape,2025-09-25 20:08:27,75,"CustomerService@AllRoundFoods.com, 1-800-428-8802customerservice@allroundfoods.com",800-428-8802
Contact from https://www.franzbakery.com/HTML/nationalSales,Rob.Teachout@usbakery.com,,https://www.franzbakery.com/HTML/nationalSales,Deep scraped from https://www.franzbakery.com/HTML/nationalSales,Frozen Bakery Products,Website Deep Scrape,2025-09-25 20:08:32,75,,
List Of Wholesale Beef Suppliers & Vendors In The USA,,,https://howtocookwithvesna.com/wholesale-beef-suppliers-vendors-in-usa/,"Weinstein Wholesale Meats Inc. can provide to a wide range of wholesale, retail, and food service clients because of its comprehensive protein offerings (beef, pig, chicken, lamb, and veal).",Meat/Wholesale,DuckDuckGo Search,2025-09-25 20:13:09,35,,
AA Meat Products Inc,,,https://aa-meat.com/,"About Us At Meat Products Inc, we're dedicated to building lasting relationships with our customers, suppliers, and community. We strive to make every interaction a positive one, whether you're shopping online or visiting our store.",Meat/Wholesale,DuckDuckGo Search,2025-09-25 20:13:09,35,,
Monarch,,,https://www.monarchllc.com/,"Distributing the finest wholesale beef, pork, lamb, mutton, poultry, and seafood from vendors all across the U.S. and overseas.",Meat/Wholesale,DuckDuckGo Search,2025-09-25 20:13:09,35,,
Wms Foods USA,,,https://wmsfoods.us/,"WMS Foods USA Global Excellence in Food Production and Distribution At WMS Foods USA, we proudly partner with the world's premier meat suppliers to produce top-quality beef, making more than 50 containers available daily to our global customer base.",Meat/Wholesale,DuckDuckGo Search,2025-09-25 20:13:09,35,,
Wholesale Meat Supplier,,,https://www.sterlingfoods-inc.com/,"Sterling Foods Inc. High-Quality Wholesale Meat Supplier Sterling Foods Inc. is a strategic partner, and goes beyond being a wholesale meat supplier. Our advanced capabilities allow us to precision portion and expertly package a wide array of product",Meat/Wholesale,DuckDuckGo Search,2025-09-25 20:13:09,35,,
Steak & Meat Suppliers for Restaurants,,,https://www.allenbrothers.com/article/restaurant-steak-suppliers/bg0029,"Allen Brothers is both a direct-to-consumer and wholesale restaurant meat supplier dedicated to providing artisanal, hand-cut, perfectly aged beef. In addition to prime cuts of ribeye, NY strip, filet, and other top-tier steaks, we also sell seafood,",Meat/Wholesale,DuckDuckGo Search,2025-09-25 20:13:09,35,,
US Foods,,,https://www.usfoods.com/,"US Foods® is one of America's leading food distributors servicing restaurants, the healthcare industry, and more. Learn about our food supply services today.",Meat/Wholesale,DuckDuckGo Search,2025-09-25 20:13:09,35,,
Wholesale Cooked Meat Supplier,,,https://www.karnmeats.com/wholesale-processed-cooked-meats/cooked-meats/,"Wholesale Cooked Meat Products Karn Meats is a regionally renowned provider of various cooked meats for further processors, distributors, restaurants and other types of manufacturers. With an emphasis on quality, our team uses only the freshest meat ",Meat/Wholesale,DuckDuckGo Search,2025-09-25 20:13:09,35,,
Jensen Meat Co.,,,https://jensenmeat.com/,"ABOUT US History Jensen Meat Company, founded in 1958 by Reggie Jensen, is a leading processor of quality ground beef products for the Food Service Distribution, Restaurant, Retail and School markets. Our commitment is to provide the best looking, be",Meat/Wholesale,DuckDuckGo Search,2025-09-25 20:13:09,35,,
Wholesale Meats Supplier,,,https://miamibeef.com/,"Providing quality burgers, ground beef, hand cut steaks and other meat items for over 100 years, globally. Proudly family owned. Hablamos Español.",Meat/Wholesale,DuckDuckGo Search,2025-09-25 20:13:09,35,,
Sysco,,,https://www.sysco.com/,"Sysco lives at the heart of food and service. We are passionately committed to the success of every customer, supplier partner, community, and associate.",Meat/Wholesale,DuckDuckGo Search,2025-09-25 20:13:09,35,,
Calvada Food Sales,,,https://calvadafoods.com/,"Calvada Foods is a large wholesale food distributor and warehouse specializing in meat products of all varieties. We are, quite simply, your best meat source in the wholesale distributing market.",Meat/Wholesale,DuckDuckGo Search,2025-09-25 20:13:09,35,,
Wholesale Meat & Animal Byproduct Supplier,,,https://www.northcentralco.com/industry/meats-animal-byproducts/,"Wholesale Meat Supplier in the US: We Deliver Quality and Variety North Central Companies has been a leading wholesale meat supplier in the United States since 1984, offering a comprehensive selection of fresh and frozen meat products, mechanically d",Meat/Wholesale,DuckDuckGo Search,2025-09-25 20:13:09,35,,
Wholesale Meat & Seafood Distributor,,,https://www.corfinigourmet.com/,"Corfini Gourmet is a wholesale meat & seafood distributor offering an extensive selection of beef, pork, poultry, lamb, seafood and specialty products.",Meat/Wholesale,DuckDuckGo Search,2025-09-25 20:13:09,35,,
Contact from https://aa-meat.com/,sales@aa-meat.com,,https://aa-meat.com/,Deep scraped from https://aa-meat.com/,Meat/Wholesale,Website Deep Scrape,2025-09-25 20:13:23,75,,
Contact from https://www.sterlingfoods-inc.com/,sterlingfoods.inc@gmail.com,(305) 953-8899,https://www.sterlingfoods-inc.com/,Deep scraped from https://www.sterlingfoods-inc.com/,Meat/Wholesale,Website Deep Scrape,2025-09-25 20:13:53,75,,
Contact from https://www.karnmeats.com/wholesale-processed-cooked-meats/cooked-meats/,info@karnmeats.com,(614) 252-8273,https://www.karnmeats.com/wholesale-processed-cooked-meats/cooked-meats/,Deep scraped from https://www.karnmeats.com/wholesale-processed-cooked-meats/cooked-meats/,Meat/Wholesale,Website Deep Scrape,2025-09-25 20:14:23,75,,"(614) 252-3712, (800) 221-9585"
LA Packaging,,,https://lapackaging.com/,"LA Packaging is here to provide companies with the ability to purchase American made, hinged-lid plastic containers. LA Packaging accepts all major credit cards, checks and company purchase orders. We also offer the ability to customize the container",Packaging Containers,DuckDuckGo Search,2025-09-25 20:16:37,35,,
Top 21 Packaging Companies in USA,,,https://ibexpackaging.com/packaging-companies-in-usa/,Top Packaging companies that are known as the best printing and packaging platforms in the USA. List of 21 packaging manufacturers. 1. International Paper Co 2. WestRock 3. Ball Corporation,Packaging Containers,DuckDuckGo Search,2025-09-25 20:16:37,35,,
Food Packaging Containers Manufacturers and Suppliers in the USA and Canada,,,https://www.thomasnet.com/suppliers/usa/food-packaging-containers-95999769?coverage_area=NA,"Food-Safety-Certified manufacturer of custom corrugated boxes, beverage trays, beverage carriers, fruit and vegetable boxes, fresh produce boxes, tomato boxes, and berry boxes. Also provides take-out boxes for flatbreads and pizza and features cold c",Packaging Containers,DuckDuckGo Search,2025-09-25 20:16:37,35,,
"Wholesale Containers, Glass & Plastic Bottles, Jars, Metal Tins",,,https://www.sks-bottle.com/,"SKS Bottle and Packaging is a container and packaging supplier, consultant, and designer. We specialize in providing top-quality plastic bottles, glass bottles, plastic jars, glass jars, metal containers, and closures to meet your packaging needs.",Packaging Containers,DuckDuckGo Search,2025-09-25 20:16:37,35,,
Romanow Container,,,http://www.romanowcontainer.com/,"Romanow Container A SupplyOne Company provides corrugated packaging, POP displays, foam packaging and a vast menu of packaging supplies. A one-stop solution provider from manufacturing and design & testing to inventory control and management.",Packaging Containers,DuckDuckGo Search,2025-09-25 20:16:37,30,,
Altium Packaging: Packaging Manufacturer & Plastic Container Design,,,https://altiumpkg.com/,Altium Packaging is one of the largest plastic container companies and suppliers of rigid plastic packaging. Find a North American supplier near you.,Packaging Containers,DuckDuckGo Search,2025-09-25 20:16:37,35,,
Brigade Packaging,,,https://brigadepackaging.com/,"Brigade Packaging - Wholesale glass and plastic containers, caps, bottles, vials, jars, bags and packaging supplier to manufacturers in USA.",Packaging Containers,DuckDuckGo Search,2025-09-25 20:16:37,35,,
"Performance Container Manufacturers, Inc.",,,https://www.performancecontainer.com/,"Performance Container Manufacturers, Inc is a manufacturer and distributor of food packaging and food service products, supplying food processors, supermarkets, restaurants, institutions, caterers, meal prep packers, wholesale paper and food service ",Packaging Containers,DuckDuckGo Search,2025-09-25 20:16:37,35,,
Thornton Plastics,,,https://www.thorntonplastics.com/,"Thornton Plastics specializes in small plastic containers and jars. These containers are perfect for packaging, shipping, storing, presenting and sampling any type of small object, liquid or product.",Packaging Containers,DuckDuckGo Search,2025-09-25 20:16:37,35,,
VisiPak,,,https://www.visipak.com/,"As specialists in the field of clear plastic packaging and rated as a premier packaging company worldwide, VisiPak not only has the ability to design and manufacture custom packages, but our line of stock clamshells and packaging tubes leads the indu",Packaging Containers,DuckDuckGo Search,2025-09-25 20:16:37,35,,
Premier Distributors of Container Products,,,https://rhinocontainer.com/,"Established in 1992 Premier Distributors of Container Products We are one of the largest distributors of plastic, metal, tin and hybrid containers in the Western US. From our 5 warehouse locations across California and the Pacific Northwest spanning ",Packaging Containers,DuckDuckGo Search,2025-09-25 20:16:37,35,,
USA Plastic Packaging Distributor,,,https://divanpackaging.com/,"Divan Packaging Is Plastic And Paper Packaging Manufacturers And Distributors. Specializes In Wholesale Containers, Food Grade Buckets, To Go Container.",Packaging Containers,DuckDuckGo Search,2025-09-25 20:16:37,35,,
Ashland Container,,,https://ashlandcontainer.com/,"Chicago-based packaging distributor specializing in custom solutions for your brand. 50+ years of expertise, unmatched service. Variety of glass and plastic containers, caps, tubs and pails for all your packaging needs. Request a consultation today!",Packaging Containers,DuckDuckGo Search,2025-09-25 20:16:37,35,,
Distributor of Wholesale Stock Packaging,,,https://distribupack.com/,"Stock Packaging for Sale Plastic Containers for Cosmetics, Food, Pharmaceuticals, & More DISTRIBUPACK is a U.S. based distributor of stock packaging fulfilling both low-volume and high-volume orders for multipurpose jars, containers, sticks, tubes, a",Packaging Containers,DuckDuckGo Search,2025-09-25 20:16:37,35,,
Packaging Supplier + Screen Printing & Labeling,,,https://www.kaufmancontainer.com/,"Packaging Supplier Kaufman Container is a leading packaging supplier in the United States. For over 100 years, we have provided stock & custom packaging components, package development, quality assurance, warehousing programs and package decoration t",Packaging Containers,DuckDuckGo Search,2025-09-25 20:16:37,35,,
Contact from https://lapackaging.com/,sales@lapackaging.com,714-694-0202,https://lapackaging.com/,Deep scraped from https://lapackaging.com/,Packaging Containers,Website Deep Scrape,2025-09-25 20:16:47,75,Sales@lapackaging.com,"(714) 694-0202, 714-694-0400, 714.694.0202"
Contact from https://lapackaging.com/,Sales@lapackaging.com,714-694-0202,https://lapackaging.com/,Deep scraped from https://lapackaging.com/,Packaging Containers,Website Deep Scrape,2025-09-25 20:16:47,75,Sales@lapackaging.com,"(714) 694-0202, 714-694-0400, 714.694.0202"
Contact from https://ibexpackaging.com/packaging-companies-in-usa/,sales@ibexpackaging.com,(855) 890-8200,https://ibexpackaging.com/packaging-companies-in-usa/,Deep scraped from https://ibexpackaging.com/packaging-companies-in-usa/,Packaging Containers,Website Deep Scrape,2025-09-25 20:16:59,75,,"855 890 8200, +1 315 210 8020, +1 855 890 8200, 315 210 8020"
Contact from https://altiumpkg.com/,techsupport@altiumpkg.com,678-742-4600,https://altiumpkg.com/,Deep scraped from https://altiumpkg.com/,Packaging Containers,Website Deep Scrape,2025-09-25 20:17:45,75,"accounting@altiumpkg.com, salesinquiry@altiumpkg.com, Phyllis.Holcomb@altiumpkg.com, 10085-customerservice@altiumpkg.com","800-392-9824, 888-844-5079, 877-206-9136, 888-946-7273, 678-561-7388, 877-239-7631"
Contact from https://altiumpkg.com/,accounting@altiumpkg.com,678-742-4600,https://altiumpkg.com/,Deep scraped from https://altiumpkg.com/,Packaging Containers,Website Deep Scrape,2025-09-25 20:17:45,75,"accounting@altiumpkg.com, salesinquiry@altiumpkg.com, Phyllis.Holcomb@altiumpkg.com, 10085-customerservice@altiumpkg.com","800-392-9824, 888-844-5079, 877-206-9136, 888-946-7273, 678-561-7388, 877-239-7631"
Contact from https://altiumpkg.com/,salesinquiry@altiumpkg.com,678-742-4600,https://altiumpkg.com/,Deep scraped from https://altiumpkg.com/,Packaging Containers,Website Deep Scrape,2025-09-25 20:17:45,75,"accounting@altiumpkg.com, salesinquiry@altiumpkg.com, Phyllis.Holcomb@altiumpkg.com, 10085-customerservice@altiumpkg.com","800-392-9824, 888-844-5079, 877-206-9136, 888-946-7273, 678-561-7388, 877-239-7631"
