company_name,email,phone,website,snippet,commodity,source,collection_date,data_quality_score,additional_emails,additional_phones
Contact from https://www.inven.ai/company-lists/top-21-metal-manufacturing-companies-in-the-us,Sourcescrub@inven.aiSign,201-5002018,https://www.inven.ai/company-lists/top-21-metal-manufacturing-companies-in-the-us,Deep scraped from https://www.inven.ai/company-lists/top-21-metal-manufacturing-companies-in-the-us,"Steel, Metal Fabrication",Website Deep Scrape,2025-09-18 17:04:22,75,,"501-1000201, 001-5000200, 001-5000197, 201-5001913, 501-1000197, 201-5001953, 201-5001910, 001-1000020, 501-1000192, 201-5002008, 001-5000201, 501-1000194, 001-5000193"
39 Vacuum Seal Manufacturers in 2025,,,https://us.metoree.com/categories/3362/,"39 Vacuum Seal Manufacturers in 2025 This section provides an overview for vacuum seals as well as their applications and principles. Also, please take a look at the list of 39 vacuum seal manufacturers and their company rankings. Here are the top-ra",Vacuum Seal Caps,DuckDuckGo Search,2025-09-18 17:05:54,35,,
Vacuum Seals Suppliers,,,https://www.thomasnet.com/suppliers/usa/vacuum-seals-73613002,"Distributor of fluid barrier and vacuum mechanical seals. Types include split, single, and dual cartridge and welded bellow. Suitable for mixers, agitators, and centrifuges. Serves the pulp and paper, refinery and api, wastewater, pharmaceutical, min",Vacuum Seal Caps,DuckDuckGo Search,2025-09-18 17:05:54,35,,
ANCORP,,,https://ancorp.com/,"Since 1965, ANCORP has empowered scientific and technological advancements with our high and ultra-high vacuum components. As a family-founded company, we take pride in supporting researchers, engineers, and manufacturers across industries by providi",Vacuum Seal Caps,DuckDuckGo Search,2025-09-18 17:05:54,35,,
Rs Closures,,,https://rsclosures.com/,"RS Closures, a specialist in the production of seals, caps, plastic closures, and lining materials. Innovative and tailored solutions for your packaging needs.",Vacuum Seal Caps,DuckDuckGo Search,2025-09-18 17:05:54,35,,
"Manufacturer of Plastic Caps, Plugs & Covers",,,https://www.stockcap.com/products/,StockCap started with a small line of caps and plugs and has grown to become one of the largest manufacturers of flexible closures in the world.,Vacuum Seal Caps,DuckDuckGo Search,2025-09-18 17:05:54,35,,
VIP Sealing,,,https://vipsealing.com/,"VIP Sealing is a full service manufacturer of mechanical seals for all types of industrial equipment. We manufacture or own VIP brand of mechanical seals, engineer special seals for tough applications, and repair all seals from all manufacturers at a",Vacuum Seal Caps,DuckDuckGo Search,2025-09-18 17:05:54,35,,
"Reliable Caps, LLC",,,https://reliablecaps.com/,"Manufacturer of plastic threaded closures.For more than 45 years, we have provided injection-molded closures for industries such as spice, household, agricultural, automotive, food, beverage, and sports bottle cap markets.",Vacuum Seal Caps,DuckDuckGo Search,2025-09-18 17:05:54,35,,
Fluid Sealing Solutions,,,https://www.sepco.com/,"Welcome to SEPCO Inc., a leading manufacturer of fluid sealing solutions and equipment products for a variety of industries. Our commitment to quality and innovation has made us the trusted choice for mechanical seals, pump and valve packing, bearing",Vacuum Seal Caps,DuckDuckGo Search,2025-09-18 17:05:54,35,,
"MOCAP, Manufacturer of Quality Plastic Caps, Rubber Plugs, Grips, and ...",,,https://mocap.com/,"Buy Plastic Caps and Plugs online direct from the manufacturer! Large selection of sizes and styles IN STOCK and ready to ship! MOCAP manufactures quality plastic and rubber components for product protection, masking and finishing.",Vacuum Seal Caps,DuckDuckGo Search,2025-09-18 17:05:54,35,,
Vacuum Fittings Manufacturers and Suppliers in the USA and Canada,,,https://www.thomasnet.com/suppliers/usa/vacuum-fittings-30081400,"Manufacturer* , Distributor ⚫ $5 - 9.9 Mil Revenue ⚫ Est. 1953 Manufacturer of vacuum fittings including adapters, caps, elbows, and tees. Made from stainless steel, aluminum, and brass. Available in NW10, NW16, NW25, NW40, and NW50 sizes. RoHS compl",Vacuum Seal Caps,DuckDuckGo Search,2025-09-18 17:05:54,35,,
Contact from https://ancorp.com/,sales@ustechwest.com,(773) 244-3102,https://ancorp.com/,Deep scraped from https://ancorp.com/,Vacuum Seal Caps,Website Deep Scrape,2025-09-18 17:06:34,75,"hartechcorp@gmail.com, sales@ancorp.com","800-352-6431, (781) 863-1448, 352-528-4100, (201) 692-7924, (206) 232-3444, (800) 898-4482, 352-528-7886, (408) 782-5850, (724) 882-0122, (469) 480-3366, (352) 528-4100"
Contact from https://ancorp.com/,hartechcorp@gmail.com,(773) 244-3102,https://ancorp.com/,Deep scraped from https://ancorp.com/,Vacuum Seal Caps,Website Deep Scrape,2025-09-18 17:06:34,75,"hartechcorp@gmail.com, sales@ancorp.com","800-352-6431, (781) 863-1448, 352-528-4100, (201) 692-7924, (206) 232-3444, (800) 898-4482, 352-528-7886, (408) 782-5850, (724) 882-0122, (469) 480-3366, (352) 528-4100"
Contact from https://ancorp.com/,sales@ancorp.com,(773) 244-3102,https://ancorp.com/,Deep scraped from https://ancorp.com/,Vacuum Seal Caps,Website Deep Scrape,2025-09-18 17:06:34,75,"hartechcorp@gmail.com, sales@ancorp.com","800-352-6431, (781) 863-1448, 352-528-4100, (201) 692-7924, (206) 232-3444, (800) 898-4482, 352-528-7886, (408) 782-5850, (724) 882-0122, (469) 480-3366, (352) 528-4100"
Contact from https://reliablecaps.com/,your@email.com,800.356.8483,https://reliablecaps.com/,Deep scraped from https://reliablecaps.com/,Vacuum Seal Caps,Website Deep Scrape,2025-09-18 17:07:16,75,,913.764.0494
Welded Wire Fabrics Suppliers,,,https://www.thomasnet.com/suppliers/usa/welded-wire-fabrics-27311802,"Manufacturer of standard and custom welded wire fabrics for agricultural and architectural industries. Made from stainless steel, plain steel, weathering steel, Galfan®, carbon steel, aluminum, brass, bronze, copper, and pre-galvanized materials.",Welded Wire Fabric,DuckDuckGo Search,2025-09-18 17:08:13,35,,
Wire Mesh & Wire Cloth Since 1854,,,https://www.darbywiremesh.com/,"Edward J. Darby & Son, Inc. - a leading supplier of woven and welded wire mesh, wire cloth & wire screen since 1854 Darby has been a mainstay in the wire mesh industry for over 160 years. We excel in supplying mesh for use in a broad range of applica",Welded Wire Fabric,DuckDuckGo Search,2025-09-18 17:08:13,35,,
Premium welded wire mesh products,,,https://riverdale.com/,"Riverdale Mills is a leading American manufacturer of premium quality welded wire mesh fabrics for the marine, security, construction and agriculture industries. Riverdale invented Aquamesh®, the industry-standard wire mesh used for building lobster ",Welded Wire Fabric,DuckDuckGo Search,2025-09-18 17:08:13,35,,
Welded Wire Mesh Products,,,https://www.marcospecialtysteel.com/product-categories/wire-cloth/welded-wire-mesh/,"Marco Specialty Steel: Your One-Stop Welded Wire Cloth Distributor Marco Specialty Steel Inc. is a full-service welded wire mesh distributor in Houston, TX that offers a wide range of welded utility mesh solutions. Choose from 16GA, 14GA and 12GA ste",Welded Wire Fabric,DuckDuckGo Search,2025-09-18 17:08:13,35,,
"Wire Cloth Supplier, Wire Mesh Manufacturer, Fabrications, Woven ...",,,https://www.universalwirecloth.com/,"As a supplier as well as a direct to consumer business, we manufacture wire mesh products for numerous industries that range from industrial grade wire cloth for sizing & filtration to security solutions and architectural applications. Whether you ar",Welded Wire Fabric,DuckDuckGo Search,2025-09-18 17:08:13,35,,
"Wire Cloth, Welded Wire Mesh, Sintered Metal, Metal Filters",,,https://dwt-inc.com/,"Dorstener Wire Tech is your single source manufacturer for high-quality, welded wire mesh, woven wire cloth, sintered wire cloth, and metallic filtration products.",Welded Wire Fabric,DuckDuckGo Search,2025-09-18 17:08:13,35,,
National Wire LLC,,,https://nationalwirellc.com/,"Specializing in standard mesh, engineered wire reinforcement, and welded wire products, we're your source for quality wire materials.",Welded Wire Fabric,DuckDuckGo Search,2025-09-18 17:08:13,35,,
Banker Wire,,,https://www.bankerwire.com/,"Banker Wire has extensive experience in weaving mesh for applications such as railing infill, enclosures, decorative mesh screens, signage, cladding, and much more. Banker Wire is your quality driven manufacturing partner for welded wire mesh.",Welded Wire Fabric,DuckDuckGo Search,2025-09-18 17:08:13,35,,
Insteel Industries Inc.,,,https://insteel.com/products-services/Welded-Wire/,"Welded Wire Reinforcement Insteel is the largest producer of welded wire reinforcement (""WWR"") in the United States. We offer a broad range of WWR products including engineered structural mesh, standard welded wire reinforcement and concrete pipe rei",Welded Wire Fabric,DuckDuckGo Search,2025-09-18 17:08:13,35,,
"Belleville Wire Cloth Co., Inc.",,,https://www.bwire.com/,"Belleville Wire Cloth Co., Inc. is a wire cloth manufacturer that was founded in 1919 by Thomas Crowley, an experienced wire cloth weaver. Three generations of the family have dedicated themselves to the design and fabrication of the highest quality ",Welded Wire Fabric,DuckDuckGo Search,2025-09-18 17:08:13,35,,
FRP Manufacturers,,,https://marlite.com/find-a-distributor/,Use our interactive FRP Panel Manufacturers map to find the nearest FRP suppliers and start your project today with Marlite. Our tool makes it easy to search for FRP panel manufacturers and slatwall distributors at the click of a button. Schedule you,FRP Panels,DuckDuckGo Search,2025-09-18 17:10:29,35,,
FRP Panels,,,https://www.fiber-tech.net/,Fiber-tech manufactures composite panels & fiberglass reinforced panels for all markets & applications. Request a quote or contact us to learn more.,FRP Panels,DuckDuckGo Search,2025-09-18 17:10:29,35,,
Fiberglass Reinforced Plastic (FRP) Panels Manufacturers and Suppliers ...,,,https://www.thomasnet.com/suppliers/usa/fiberglass-reinforced-plastic-frp-panels-56620305,"Distributor of panels made from fiberglass reinforced plastic (FRP) material for architectural application. Corrugated, fire resistant and display wall panels are offered.",FRP Panels,DuckDuckGo Search,2025-09-18 17:10:29,35,,
Translucent and Opaque Custom FRP Panels,,,https://kal-lite.com/,"Explore high-quality custom FRP panels designed for resilience. Trust the expertise of Kal-Lite, one of the premier FRP panel manufacturers in the industry.",FRP Panels,DuckDuckGo Search,2025-09-18 17:10:29,35,,
VALTO Engineered Materials,,,https://valtoem.com/,"Since 1954, Valto Engineered Materials has provided innovative products and services and is a leading provider of FRP composite panels. Our lightweight composite products deliver unsurpassed strength and durability; and we continue to pioneer next le",FRP Panels,DuckDuckGo Search,2025-09-18 17:10:29,35,,
Are you looking for Glasteel FRP manufacturers?,,,https://www.stabilitamerica.com/company/glasteel/,"About us Glasteel, a subsidiary of Stabilit America Inc., is the leading manufacturer of fiberglass reinforced plastic panels in North America, providing the largest selection of Fiberglass Reinforced Plastic, Polycarbonate, and PVC panels available ",FRP Panels,DuckDuckGo Search,2025-09-18 17:10:29,35,,
FRP Distributor,,,https://frpdistributor.com/,FRP Distributor Inc is a global leading distributor of Fibreglass Reinforced Polymer (FRP) structural products and systems with a commitment to unprecedented quality in our Engineering and production.,FRP Panels,DuckDuckGo Search,2025-09-18 17:10:29,35,,
Fibergrate Composite Structures,,,https://www.fibergrate.com/,Fibergrate is Building the World to Last as the leading manufacturer of fiberglass reinforced plastic (FRP) solutions for industrial and commercial use globally.,FRP Panels,DuckDuckGo Search,2025-09-18 17:10:29,35,,
Pultruded Fiberglass,,,https://www.strongwell.com/,"We are the preferred Pultruded Fiberglass supplier, best value producer of Fiber Reinforced Polymer, & leading innovator of pultruded composites & structures.",FRP Panels,DuckDuckGo Search,2025-09-18 17:10:29,35,,
Contact from https://marlite.com/find-a-distributor/,info@marlite.com,330.343.7296,https://marlite.com/find-a-distributor/,Deep scraped from https://marlite.com/find-a-distributor/,FRP Panels,Website Deep Scrape,2025-09-18 17:10:39,75,,"562.926.7308, 330.343.6621, 817.385.0549, 817.652.2642, 800.377.1221, 562.926.7208, 800-377-1221"
Contact from https://kal-lite.com/,info@kal-Lite.com,603-229-0339,https://kal-lite.com/,Deep scraped from https://kal-lite.com/,FRP Panels,Website Deep Scrape,2025-09-18 17:11:18,75,"info@kal-lite.com, info@Kal-Lite.com",800-526-1609
Contact from https://kal-lite.com/,info@kal-lite.com,603-229-0339,https://kal-lite.com/,Deep scraped from https://kal-lite.com/,FRP Panels,Website Deep Scrape,2025-09-18 17:11:18,75,"info@kal-lite.com, info@Kal-Lite.com",800-526-1609
Contact from https://kal-lite.com/,info@Kal-Lite.com,603-229-0339,https://kal-lite.com/,Deep scraped from https://kal-lite.com/,FRP Panels,Website Deep Scrape,2025-09-18 17:11:18,75,"info@kal-lite.com, info@Kal-Lite.com",800-526-1609
Contact from https://valtoem.com/,voc@valtoem.com,800.435.0080,https://valtoem.com/,Deep scraped from https://valtoem.com/,FRP Panels,Website Deep Scrape,2025-09-18 17:11:35,75,sales@valtoem.com,"815.467.8600, 815.446.0584"
Contact from https://valtoem.com/,sales@valtoem.com,800.435.0080,https://valtoem.com/,Deep scraped from https://valtoem.com/,FRP Panels,Website Deep Scrape,2025-09-18 17:11:35,75,sales@valtoem.com,"815.467.8600, 815.446.0584"
Contact from https://www.fibergrate.com/,info@fibergrate.com,(972) 250-1530,https://www.fibergrate.com/,Deep scraped from https://www.fibergrate.com/,FRP Panels,Website Deep Scrape,2025-09-18 17:12:30,75,,"(972) 250-1633, (800) 527-4043"
