company_name,email,phone,website,snippet,commodity,source,collection_date,data_quality_score,additional_emails,additional_phones
Paper Converting Services Suppliers,,,https://www.thomasnet.com/suppliers/usa/paper-converters-56901606,Paper Converting Services Suppliers Welcome to this comprehensive resource for Paper Converting Services Suppliers and Manufacturers on Thomas. Here you can find any Paper Converting Services Suppliers that suits your needs. If Ownership Diversity is,Paper Converting,DuckDuckGo Search,2025-09-25 20:19:00,35,,
"Industrial Paper Converting Manufacturer, Custom Paper Converters ...",,,https://kraftwrap.com/paper-converter-manufacturer-custom-paper-converting-factory-usa-facility,Premier Paper Converter - Experienced Paper Converting Services Kraft Wrap is an experienced paper converting manufacturer. We are a custom contract converting company serving customers across the USA and the world. We been specializing in contract p,Paper Converting,DuckDuckGo Search,2025-09-25 20:19:00,35,,
"Welcome to CT Commercial Paper, LLC",,,https://ctcpaper.com/,"2024 Celebrates our 25 year milestone and ushers in another new converting line. 2024 marks 25 years in business for CT Commercial Paper LLC and celebrates over 2 decades of direct, hands-on experience, and a continued dedication and commitment to co",Paper Converting,DuckDuckGo Search,2025-09-25 20:19:00,35,,
United States: Paper Converters,,,https://www.paperindex.com/paper-converters-in-united-states/8/9,"Sullivan Paper Co., Inc. is located in West Springfield, Massachusetts, USA. We are a Rotogravure and Flexographic Gift Wrap and Box Wrap Printer and Converter that have been supplying this trade... View profile Profile recently viewed by buyers from",Paper Converting,DuckDuckGo Search,2025-09-25 20:19:00,35,,
"Shamrock Paper Company, your paper converter industry leader",,,https://shamrockpaper.com/,Shamrock Paper supplies the industry with superior products and exceptional services. Our prices are competitive and fair. We have over 45 years experience in paper product manufacturing. Our dedicated staff and state of the art equipment continues t,Paper Converting,DuckDuckGo Search,2025-09-25 20:19:00,35,,
ProCon,,,https://proconusa.com/,"Their goal was to provide high-quality converting services to merchants, commercial printers and paper mills. Today, ProCon is the largest independent paper converter by market share in the United States and the premier converting & logistics partner",Paper Converting,DuckDuckGo Search,2025-09-25 20:19:00,35,,
Specialty Paper Distributor,,,https://www.papertecinc.com/,"Papertec offers custom paper converting, slitting, sheeting, die-cutting, and specialty films with 85+ years of quality and precision. Request a quote today.",Paper Converting,DuckDuckGo Search,2025-09-25 20:19:00,35,,
South Coast Paper,,,https://www.southcoastpaper.com/,"At South Coast Paper, we specialize in paper converting, roll slitting, rewinding, and sheeting services as well as manufacturing a vast array of paper products and corrugated packaging solutions.",Paper Converting,DuckDuckGo Search,2025-09-25 20:19:00,35,,
Paper Converting Company│Paper Converters,,,https://www.oren-intl.com/,"Oren International is a leading paper converting company for distributors in many industries, including restaurant, industrial, packaging & medical.",Paper Converting,DuckDuckGo Search,2025-09-25 20:19:00,35,,
River Valley Converting,,,https://rivervalleyconverting.com/,"For businesses and manufacturers who require customized solutions, River Valley Converting offers both paper and packaging converting services to fit your needs. You will work directly with our knowledgeable team to convert products to your exact siz",Paper Converting,DuckDuckGo Search,2025-09-25 20:19:00,35,,
"Paper Converting Products and Services, Paper Converting Manufacturer ...",,,https://kraftwrap.com/,"Paper die cutting and paperboard die cutting services for the food service, cosmetics, retail, and other industries. Finishing capabilities include slitting, rewinding, converting, and laminating.",Paper Converting,DuckDuckGo Search,2025-09-25 20:19:00,35,,
Paper Converting Equipment,,,https://www.bretting.com/,Bretting Manufacturing - world-class paper converting equipment supplier. Full lines or machine sections built to your specifications.,Paper Converting,DuckDuckGo Search,2025-09-25 20:19:00,35,,
North America: Paper Converters,,,https://www.paperindex.com/paper-converters-in-north-america/8/12,"We are a Tissue Paper converting company located in Port-au- Prince, Haiti. Our immediate production focus is bath tissue and napkins. View profile Profile recently viewed by buyers from United Arab Emirates, China, United States, Germany, Canada.",Paper Converting,DuckDuckGo Search,2025-09-25 20:19:00,35,,
Contact from https://www.thomasnet.com/suppliers/usa/paper-converters-56901606,sales@adhue.com,862-591-1100,https://www.thomasnet.com/suppliers/usa/paper-converters-56901606,Deep scraped from https://www.thomasnet.com/suppliers/usa/paper-converters-56901606,Paper Converting,Website Deep Scrape,2025-09-25 20:19:09,75,sales@papertec.com,"888-932-8836, 763-781-8072, 607-432-6500"
Contact from https://www.thomasnet.com/suppliers/usa/paper-converters-56901606,sales@papertec.com,862-591-1100,https://www.thomasnet.com/suppliers/usa/paper-converters-56901606,Deep scraped from https://www.thomasnet.com/suppliers/usa/paper-converters-56901606,Paper Converting,Website Deep Scrape,2025-09-25 20:19:09,75,sales@papertec.com,"888-932-8836, 763-781-8072, 607-432-6500"
Contact from https://ctcpaper.com/,orders@ctcpaper.com,(704)485-3212,https://ctcpaper.com/,Deep scraped from https://ctcpaper.com/,Paper Converting,Website Deep Scrape,2025-09-25 20:19:25,75,,"(704) 485-3212, 704-485.3212"
Contact from https://www.paperindex.com/paper-converters-in-united-states/8/9,wecare@paperindex.com,,https://www.paperindex.com/paper-converters-in-united-states/8/9,Deep scraped from https://www.paperindex.com/paper-converters-in-united-states/8/9,Paper Converting,Website Deep Scrape,2025-09-25 20:19:36,75,,
Contact from https://shamrockpaper.com/,orders@shamrockpaper.com,314-241-2370,https://shamrockpaper.com/,Deep scraped from https://shamrockpaper.com/,Paper Converting,Website Deep Scrape,2025-09-25 20:19:46,75,,"314-241-9230, (314) 241-2370"
Contact from https://www.papertecinc.com/,sales@papertecinc.com,888-444-9911,https://www.papertecinc.com/,Deep scraped from https://www.papertecinc.com/,Paper Converting,Website Deep Scrape,2025-09-25 20:20:10,75,,862-591-1103
Contact from https://www.southcoastpaper.com/,info@southcoastpaper.com,803.758.4054,https://www.southcoastpaper.com/,Deep scraped from https://www.southcoastpaper.com/,Paper Converting,Website Deep Scrape,2025-09-25 20:20:19,75,,"609.360.9002, 803-758-4054, 870.361.1942"
FRP Manufacturers,,,https://marlite.com/find-a-distributor/,Use our interactive FRP Panel Manufacturers map to find the nearest FRP suppliers and start your project today with Marlite. Our tool makes it easy to search for FRP panel manufacturers and slatwall distributors at the click of a button. Schedule you,FRP Panels,DuckDuckGo Search,2025-09-25 20:26:11,35,,
FRP Panels,,,https://www.fiber-tech.net/,"Manufacturer of fiberglass reinforced panels for transportation, construction, corrosion, armor & ballistics, military, shelter, and marine markets Since incorporation in 1983, Fiber-Tech Industries, Inc. has grown to become the largest manufacturer ",FRP Panels,DuckDuckGo Search,2025-09-25 20:26:11,35,,
Fiberglass Reinforced Plastic (FRP) Panels Manufacturers and Suppliers ...,,,https://www.thomasnet.com/suppliers/usa/fiberglass-reinforced-plastic-frp-panels-56620305,"Manufacturer of composite roofing and siding panels made from fiberglass reinforced plastic (FRP). Types include translucent and opaque panels. Features include embossed surfaces, chemical, corrosion, shatter, impact, weather, puncturing, and tearing",FRP Panels,DuckDuckGo Search,2025-09-25 20:26:11,35,,
Translucent and Opaque Custom FRP Panels,,,https://kal-lite.com/,"Explore high-quality custom FRP panels designed for resilience. Trust the expertise of Kal-Lite, one of the premier FRP panel manufacturers in the industry.",FRP Panels,DuckDuckGo Search,2025-09-25 20:26:11,35,,
About Us,,,https://www.stabilitamerica.com/about-us/,"About Us Stabilit America Inc., is the leading manufacturer of fiberglass reinforced plastic panels in North America, providing the largest selection of Fiberglass Reinforced Plastic and Polycarbonate panels available on the market and is recognized ",FRP Panels,DuckDuckGo Search,2025-09-25 20:26:11,35,,
VALTO Engineered Materials,,,https://valtoem.com/,"Since 1954, Valto Engineered Materials has provided innovative products and services and is a leading provider of FRP composite panels. Our lightweight composite products deliver unsurpassed strength and durability; and we continue to pioneer next le",FRP Panels,DuckDuckGo Search,2025-09-25 20:26:11,35,,
Fibergrate Composite Structures,,,https://www.fibergrate.com/,Fibergrate is Building the World to Last as the leading manufacturer of fiberglass reinforced plastic (FRP) solutions for industrial and commercial use globally.,FRP Panels,DuckDuckGo Search,2025-09-25 20:26:11,35,,
Liberty Pultrusions,,,https://www.libertypultrusions.com/,Liberty Pultrusions is a U.S. manufacturer of engineered FRP pultrusions with 40+ years in the fiberglass reinforced plastics industry. Contact us for you FRP pultruded product needs.,FRP Panels,DuckDuckGo Search,2025-09-25 20:26:11,35,,
Pultruded Fiberglass,,,https://www.strongwell.com/,"We are the preferred Pultruded Fiberglass supplier, best value producer of Fiber Reinforced Polymer, & leading innovator of pultruded composites & structures.",FRP Panels,DuckDuckGo Search,2025-09-25 20:26:11,35,,
Leading FRP Manufacturer-GTOFRP™,,,https://www.gtofrp.com/,"This comprehensive guide breaks down FRP installation costs, materials like FRP panels, rebar, beams, and profiles, and compares fiberglass vs steel reinforcement.",FRP Panels,DuckDuckGo Search,2025-09-25 20:26:11,35,,
Contact from https://marlite.com/find-a-distributor/,info@marlite.com,330.343.6621,https://marlite.com/find-a-distributor/,Deep scraped from https://marlite.com/find-a-distributor/,FRP Panels,Website Deep Scrape,2025-09-25 20:26:21,75,,"330.343.7296, 562.926.7308, 562.926.7208, 800-377-1221, 817.385.0549, 800.377.1221, 817.652.2642"
Contact from https://kal-lite.com/,info@kal-lite.com,603-229-0339,https://kal-lite.com/,Deep scraped from https://kal-lite.com/,FRP Panels,Website Deep Scrape,2025-09-25 20:26:59,75,"info@kal-Lite.com, info@Kal-Lite.com",800-526-1609
Contact from https://kal-lite.com/,info@kal-Lite.com,603-229-0339,https://kal-lite.com/,Deep scraped from https://kal-lite.com/,FRP Panels,Website Deep Scrape,2025-09-25 20:26:59,75,"info@kal-Lite.com, info@Kal-Lite.com",800-526-1609
Contact from https://kal-lite.com/,info@Kal-Lite.com,603-229-0339,https://kal-lite.com/,Deep scraped from https://kal-lite.com/,FRP Panels,Website Deep Scrape,2025-09-25 20:26:59,75,"info@kal-Lite.com, info@Kal-Lite.com",800-526-1609
Contact from https://valtoem.com/,sales@valtoem.com,815.446.0584,https://valtoem.com/,Deep scraped from https://valtoem.com/,FRP Panels,Website Deep Scrape,2025-09-25 20:27:24,75,voc@valtoem.com,"815.467.8600, 800.435.0080"
Contact from https://valtoem.com/,voc@valtoem.com,815.446.0584,https://valtoem.com/,Deep scraped from https://valtoem.com/,FRP Panels,Website Deep Scrape,2025-09-25 20:27:24,75,voc@valtoem.com,"815.467.8600, 800.435.0080"
Contact from https://www.fibergrate.com/,info@fibergrate.com,(972) 250-1633,https://www.fibergrate.com/,Deep scraped from https://www.fibergrate.com/,FRP Panels,Website Deep Scrape,2025-09-25 20:27:43,75,,"(972) 250-1530, (800) 527-4043"
Contact from https://www.libertypultrusions.com/,sales@libertypultrusions.com,(412) 466-8611,https://www.libertypultrusions.com/,Deep scraped from https://www.libertypultrusions.com/,FRP Panels,Website Deep Scrape,2025-09-25 20:27:56,75,,412.466.8611
Slab Distributor,,,https://www.msisurfaces.com/business-segments/slab-distributor/,"As the largest slab importer and supplier in North America, MSI distributes more natural stone and quartz slabs within the United States than any other company.",Granite Slabs,DuckDuckGo Search,2025-09-25 20:28:47,35,,
Wholesale Stone Distributor,,,https://www.jjgraniteinc.com/,"Thank you for visiting JJ Granite, a top importer, and wholesaler of premium quality natural and man-made stone slabs. Our expertly curated selection ensures that we only offer the highest quality surface materials for your project needs. With over 1",Granite Slabs,DuckDuckGo Search,2025-09-25 20:28:47,35,,
UNITED GRANITE USA,,,https://www.unitedgraniteusa.com/,"UNITED GRANITE USA offers a wide range of marble, granite, quartz, and quartzite slabs for various applications.",Granite Slabs,DuckDuckGo Search,2025-09-25 20:28:47,35,,
"Natural Stone, Quartz, and Granite Suppliers",,,http://www.acegraniteusa.com/,"A Leading Natural Stone and Granite Supplier in the Southeast Ace Granite stocks a wide selection of granite, quartz and marble as well as quartzite, travertine, onyx and porcelain. Regardless of the size of project, our wholesale inventory has beaut",Granite Slabs,DuckDuckGo Search,2025-09-25 20:28:47,30,,
"Natural Stone Distributor in USA, Marble and Granite Supplier",,,https://stonewarehouseoftampa.com/,The Quartz and Natural Stone Distributor in USA Stone Warehouse USA is one of the largest natural stone distributors in the US and suppliers of engineered stone designed by pushing the boundaries of durability and exuberant appeal while opening a new,Granite Slabs,DuckDuckGo Search,2025-09-25 20:28:47,35,,
"U.S. Stone Supply: Wholesale Slab Supplier (Granite, Marble & More)",,,https://usstonesupply.com/,"U.S. Stone Supply Countertops, Cabinets, Closets & Pavers Granite, Marble, Quartz, Quartzite and Porcelain Slab Supplier. Open Monday Through Saturday!",Granite Slabs,DuckDuckGo Search,2025-09-25 20:28:47,35,,
Kafka Granite,,,https://www.kafkagranite.com/,"Kafka Granite delivers some of North America's most spectacular natural stone products from the earth's surface to dream homes, parks, and commercial properties around the world. As one of the leading granite manufacturers in the USA, we offer quarry",Granite Slabs,DuckDuckGo Search,2025-09-25 20:28:47,35,,
Jessie Kan Granite,,,https://jkginc.com/,"North America's Premier Supplier of Granite, Marble & Quartz Slabs Jessie Kan Granite has been supplying North America's leading distributors with the best selections of Granite, Marble, Quartz and Soapstone surfaces since 2005. Look no further for t",Granite Slabs,DuckDuckGo Search,2025-09-25 20:28:47,35,,
"Top Granite Slabs Importers, Suppliers, and Distributors in USA",,,https://stonewarehouseusa.com/products/natural-stones/granite,"These minerals combine to give granite its exceptional strength and the captivating variety of colors and patterns we treasure. Granite can be defined as a coarse-grained intrusive igneous rock. Being the leading granite slab supplier in USA, we prov",Granite Slabs,DuckDuckGo Search,2025-09-25 20:28:47,35,,
Top 100 Granite Suppliers in United States (2025),,,https://ensun.io/search/granite/united-states,"The company, New View Marble and Granite, is a direct importer and installer of granite, offering a wide selection of high-quality granite countertops. Their commitment to superior craftsmanship and competitive pricing ensures customers receive excep",Granite Slabs,DuckDuckGo Search,2025-09-25 20:28:47,35,,
Contact from https://www.jjgraniteinc.com/,Info@jjgraniteinc.com,(470) 854-0947,https://www.jjgraniteinc.com/,Deep scraped from https://www.jjgraniteinc.com/,Granite Slabs,Website Deep Scrape,2025-09-25 20:29:01,75,info@jjgraniteinc.com,
Contact from https://www.jjgraniteinc.com/,info@jjgraniteinc.com,(470) 854-0947,https://www.jjgraniteinc.com/,Deep scraped from https://www.jjgraniteinc.com/,Granite Slabs,Website Deep Scrape,2025-09-25 20:29:01,75,info@jjgraniteinc.com,
Contact from https://stonewarehouseoftampa.com/,tampa@stonewarehouseusa.com,(407) 730-3420,https://stonewarehouseoftampa.com/,Deep scraped from https://stonewarehouseoftampa.com/,Granite Slabs,Website Deep Scrape,2025-09-25 20:30:04,75,,"(239) 631-5046, (813) 514-2140, (586) 991-6613"
Wholesale Secondhand Clothing,,,https://www.garsonshaw.com/,Welcome to the world of wholesale secondhand clothes. Garson & Shaw are used clothing suppliers across the USA and worldwide.,Used Clothing,DuckDuckGo Search,2025-09-25 20:31:15,35,,
Second Hand Clothes Wholesale,,,https://aeclothing.net/,"A&E Clothing Corporation, formerly American Used Clothing Corporation, is a leading used clothing supplier established in 1996. Specializing in collecting and reselling second-hand clothing, we prioritize quality and sustainability.",Used Clothing,DuckDuckGo Search,2025-09-25 20:31:15,35,,
Top 5 Used Clothing Suppliers In USA,,,https://www.zagumi.com/top-5-used-clothing-suppliers-in-usa/,"You will find the top 5 used clothing suppliers in the USA, some basic information about them, and important things to note when choosing one.",Used Clothing,DuckDuckGo Search,2025-09-25 20:31:15,35,,
Top Second Hand Clothing Suppliers in the USA,,,https://www.indetexx.com/top-usa-used-clothing-suppliers/,Discover the best USA second hand clothing suppliers in this list that offer a wide range of used apparel at affordable prices that benefit your business.,Used Clothing,DuckDuckGo Search,2025-09-25 20:31:15,35,,
American International Export,,,http://americaninternationalexport.com/,"We are the SUPPLIERS, with over 180,000 square feet of warehouse space and more than 300 employees who do nothing but process clothing all day long. We sort and process hundreds of thousands of pounds weekly of brand name dress shirts, blue jeans, ov",Used Clothing,DuckDuckGo Search,2025-09-25 20:31:15,30,,
USA Used Clothing Suppliers and Manufacturers,,,https://www.go4worldbusiness.com/suppliers/united%20states/used-clothing.html,Find Used Clothing Suppliers. Get latest factory price for Used Clothing. Request quotations and connect with USA manufacturers and B2B suppliers of Used Clothing. Page - 1,Used Clothing,DuckDuckGo Search,2025-09-25 20:31:15,35,,
Used Clothing Suppliers in the USA and Canada,,,https://www.thomasnet.com/suppliers/usa/used-clothing-15330301,"Wholesale distributor of used clothing including pants and t-shirts. Rags, shoes, backpacks, belts, handbags, luggage, sporting goods, kitchenware, bicycles, and toys are also provided.",Used Clothing,DuckDuckGo Search,2025-09-25 20:31:15,35,,
Wholesale Used Clothes,,,https://www.southernragscompany.com/,"Southern Rags Company is a United States based Wholesaler of Used Clothing, Second-hand Clothing, Overstock, Shoes and more.",Used Clothing,DuckDuckGo Search,2025-09-25 20:31:15,35,,
Wholesale Used Clothing,,,https://www.caltextraders.com/,"CalTex Traders is the Largest Secondhand Clothing, Used Shoes Exporter, Liquidation clothing exporter across the USA and worldwide.",Used Clothing,DuckDuckGo Search,2025-09-25 20:31:15,35,,
USA Used Clothes Suppliers and Wholesalers,,,https://www.tradewheel.com/used-clothes/usa/,Get Connected with Used Clothes suppliers and wholesalers from USA and expand your trade globally with Tradewheel. There are 10 Used Clothes suppliers of USA registered in Tradewheel.com.,Used Clothing,DuckDuckGo Search,2025-09-25 20:31:15,35,,
Cycla LLC,,,https://www.cyclallc.com/,"Our extensive expertise and global networking have made us a trusted leader in used clothing brokerage and textile reuse. We connect a reliable network of buyers and suppliers worldwide, ensuring credible and sustainable solutions for secondhand clot",Used Clothing,DuckDuckGo Search,2025-09-25 20:31:15,35,,
Sustainable Loop LLC,,,https://sustainableloopllc.com/,"What is Sustainable Loop do? We are a USA based trading company specialized in recyclable used clothing, including mixed rags, vintage fashion, reworked garments, industrial wiper rags and textile recycling. We work with a wide network of suppliers a",Used Clothing,DuckDuckGo Search,2025-09-25 20:31:15,35,,
Contact from https://aeclothing.net/,info@aeclothing.net,+1 732 802 8100,https://aeclothing.net/,Deep scraped from https://aeclothing.net/,Used Clothing,Website Deep Scrape,2025-09-25 20:31:34,75,,"732 802 8100, (732) 802-8100"
Contact from https://www.zagumi.com/top-5-used-clothing-suppliers-in-usa/,sales@zagumi.com,1912051972,https://www.zagumi.com/top-5-used-clothing-suppliers-in-usa/,Deep scraped from https://www.zagumi.com/top-5-used-clothing-suppliers-in-usa/,Used Clothing,Website Deep Scrape,2025-09-25 20:31:46,75,,"+86 19120519729, 1890301065, +86 18903010650"
AmeriChicken,,,https://www.americhicken.com/,"A Premier Wholesale Poultry Provider For nearly 25 years, AmeriChicken has been a trusted partner to delis, quick-service restaurants, and convenience stores, delivering ready-to-cook chicken products that stand out for their flavor, consistency, and",Frozen Poultry and Foods,DuckDuckGo Search,2025-09-25 20:33:15,35,,
Plum Group Foods,,800-386-6741,https://plumgroupfoods.com/,"Plum Group Foods provide the highest quality frozen food ingredients, offers logistics services, & has a customized warehouse for offering local inventory in USA. Give us a call at 800-386-6741 to know more.",Frozen Poultry and Foods,DuckDuckGo Search,2025-09-25 20:33:15,65,,
Keystone Foods LLC,,,https://keystone-foodsllc.com/,"Keystone Foods is proud to be one of the top poultry processors in the United States. We focus on providing the highest quality products and unmatched service throughout the poultry growing, manufacturing and distribution processes.",Frozen Poultry and Foods,DuckDuckGo Search,2025-09-25 20:33:15,35,,
"Integrity Foods, Inc.",,,http://www.integrityfoodsinc.com/,"The mission of Integrity Foods, Inc. is to provide high quality frozen chicken products and service to our customers at aggressive pricing. We want to be the ""good value"" supplier to you.",Frozen Poultry and Foods,DuckDuckGo Search,2025-09-25 20:33:15,30,,
Rio Star Foods,,,https://www.riostarfoods.com/,"Who are we? Rio Star Foods is a custom USDA poultry processor located in Dallas, Texas providing quality fresh and frozen products to wholesalers, distributors, manufacturers, retailers and foodservice operators.",Frozen Poultry and Foods,DuckDuckGo Search,2025-09-25 20:33:15,35,,
"Frozen Food Distributors, Bulk Frozen Foods",,,https://www.marvellfoods.com/frozen-food-distributors/,"Frozen Food Distributors As one of the industry's leading frozen food distributors in the USA, we work closely with both buyers and sellers—including wholesalers, retailers, distributors, cold storage warehouses, and even refrigerated truck insurance",Frozen Poultry and Foods,DuckDuckGo Search,2025-09-25 20:33:15,35,,
Top 100 Frozen Poultry Companies in United States (2025),,,https://ensun.io/search/frozen-poultry/united-states,"JBT is a prominent global manufacturer that specializes in technology solutions for the food and beverage industry, including frozen poultry. Their comprehensive product portfolio encompasses equipment designed for various food processing needs, high",Frozen Poultry and Foods,DuckDuckGo Search,2025-09-25 20:33:15,35,,
Frozen Meat Product Manufacturers Suppliers Processors USA,,,https://www.frozen-goods.com/frozen-meat-product-manufacturers-suppliers-processors-usa/,"Frozen Meat Product Manufacturers Suppliers Processors USA On this page you'll find a list and contact information of frozen Meat Product suppliers, manufacturers, processors, specialists, importers, traders, wholesalers and distributors of (IQF) Fro",Frozen Poultry and Foods,DuckDuckGo Search,2025-09-25 20:33:15,35,,
Wholesale Frozen Food Sourcing,,,https://frozenfoodinc.com/,"Quality wholesale frozen food sourcing from the best cold chain manufacturers, distributors, and refrigerated transport businesses on the planet.",Frozen Poultry and Foods,DuckDuckGo Search,2025-09-25 20:33:15,35,,
Frozen Ready-made poultry food Manufacturers in Usa,,,https://www.frozenb2b.com/category-supplier/frozen-prepared-food-frozen-ready-meals-frozen-ready-made-poultry-food/?_suppliers_country=usa,"Below you will find a list of suppliers, processors, producers, wholesalers, importers, traders, distributors Manufacturers of Frozen Ready-made poultry food.",Frozen Poultry and Foods,DuckDuckGo Search,2025-09-25 20:33:15,35,,
Contact from https://plumgroupfoods.com/,sales@plumgroupfoods.com,800-386-6741,https://plumgroupfoods.com/,Deep scraped from https://plumgroupfoods.com/,Frozen Poultry and Foods,Website Deep Scrape,2025-09-25 20:33:38,75,,
Contact from https://keystone-foodsllc.com/,sales@keystone-foodsllc.com,865 935 9434,https://keystone-foodsllc.com/,Deep scraped from https://keystone-foodsllc.com/,Frozen Poultry and Foods,Website Deep Scrape,2025-09-25 20:33:48,75,Emailsales@keystone-foodsllc.com,+1 865 935 9434
Contact from https://keystone-foodsllc.com/,Emailsales@keystone-foodsllc.com,865 935 9434,https://keystone-foodsllc.com/,Deep scraped from https://keystone-foodsllc.com/,Frozen Poultry and Foods,Website Deep Scrape,2025-09-25 20:33:48,75,Emailsales@keystone-foodsllc.com,+1 865 935 9434
Contact from https://www.riostarfoods.com/,info@riostarfoods.com,214-630-4455,https://www.riostarfoods.com/,Deep scraped from https://www.riostarfoods.com/,Frozen Poultry and Foods,Website Deep Scrape,2025-09-25 20:34:23,75,,
