company_name,email,phone,website,snippet,commodity,source,collection_date,data_quality_score,additional_emails,additional_phones
Manufacturer of Precision Bearings and Custom Bearings,,,https://www.scheererbearing.com/,"Scheerer Bearing is a USA-based manufacturer of precision and custom bearings. We specialize in large industrial-grade bearings and offer engineering expertise, reconditioning, and global shipping.",Bearings,DuckDuckGo Search,2025-09-18 16:35:55,35,,
Made in the USA Bearings,,,https://schatzbearing.com/made-in-usa/,"As a Made in the USA manufacturer of precision bearings, Schatz sources high-quality materials and machines them to tight tolerances. We source materials from other Made in America suppliers who are also committed to quality and understand the import",Bearings,DuckDuckGo Search,2025-09-18 16:35:55,35,,
Top 10 bearings companies in USA,,,https://www.rollsbearing.com/23007-top-10-bearings-companies-in-usa.html,"Conclusion: There you have it - the top 10 bearings companies in the United States. While this list is by no means exhaustive, it should give you a good starting point when looking for quality bearings manufacturers. When selecting a supplier, be sur",Bearings,DuckDuckGo Search,2025-09-18 16:35:55,35,,
Bearings Manufacturers and Suppliers in the USA and Canada,,,https://www.thomasnet.com/suppliers/usa/bearings-3650207,"Distributor of ball and roller bearings for construction, material handling, packaging, food processing, power generation, power tools, and power transmission applications. Ball bearings include deep groove radial, angular contact, miniature/instrume",Bearings,DuckDuckGo Search,2025-09-18 16:35:55,35,,
Ball & Roller Bearings Supplier,,,https://www.bakerbearing.com/,Baker Bearing Company serves as a leading ball & roller bearings supplier & power transmission parts distributor for more than 30 years. Contact us today!,Bearings,DuckDuckGo Search,2025-09-18 16:35:55,35,,
Bearings 'R Us,,,https://www.bearingsrus.com/,"At Bearings 'R Us, customers can expect a vast selection of bearings from leading manufacturers, ensuring reliability, durability, and superior performance. Our extensive catalog encompasses a variety of product types, including deep groove ball bear",Bearings,DuckDuckGo Search,2025-09-18 16:35:55,35,,
United Bearing Company,,,https://www.unitedbearingcompany.com/index_php.html,*UNITED BEARING is not an authorized distributor for these manufacturers. Manufacturer's original packaging is often available. United Bearing is the World's #1 Source for bearings no longer in regular production and other hard to find items.,Bearings,DuckDuckGo Search,2025-09-18 16:35:55,35,,
Top Bearing Manufacturers in the USA: Your Guide to Quality and ...,,,https://industrial-wholesale.com/blog/bearing-manufacturers-in-usa/,"Explore the top 10 bearing manufacturers in the USA, from custom ball bearings to industrial solutions. Find quality suppliers and contact us today!",Bearings,DuckDuckGo Search,2025-09-18 16:35:55,35,,
"Bearing, Clutch, and Labyrinth Seal Supplier",,,https://www.gmnbt.com/,"GMN Bearing USA Located in Houston, TX, we supply GMN manufactured precision bearings, sprag clutches, and non-contact seals to OEMs, MROs, and distributors in North America while providing world-class engineering support and technical services.",Bearings,DuckDuckGo Search,2025-09-18 16:35:55,35,,
Superior Bearing & Supply,,,https://superiorbearings.com/,"Superior Bearing and Supply Superior Bearing is a bearing and seal solution company supplying industrial distributors, original equipment manufacturers, and wholesalers throughout North America. Superior's manufacturer network consists of bearing man",Bearings,DuckDuckGo Search,2025-09-18 16:35:55,35,,
Contact from https://www.rollsbearing.com/23007-top-10-bearings-companies-in-usa.html,sales@rollsbearing.com,852-2137605,https://www.rollsbearing.com/23007-top-10-bearings-companies-in-usa.html,Deep scraped from https://www.rollsbearing.com/23007-top-10-bearings-companies-in-usa.html,Bearings,Website Deep Scrape,2025-09-18 16:36:28,75,karin@rollsbearing.com,
Contact from https://www.rollsbearing.com/23007-top-10-bearings-companies-in-usa.html,karin@rollsbearing.com,852-2137605,https://www.rollsbearing.com/23007-top-10-bearings-companies-in-usa.html,Deep scraped from https://www.rollsbearing.com/23007-top-10-bearings-companies-in-usa.html,Bearings,Website Deep Scrape,2025-09-18 16:36:28,75,karin@rollsbearing.com,
Contact from https://www.bakerbearing.com/,Sales@bakerbearing.com,(800)808-5412,https://www.bakerbearing.com/,Deep scraped from https://www.bakerbearing.com/,Bearings,Website Deep Scrape,2025-09-18 16:36:49,75,brian@bakerbearing.com,"(800)875-6211, 800-875-6211, (800) 808-5412"
Contact from https://www.bakerbearing.com/,brian@bakerbearing.com,(800)808-5412,https://www.bakerbearing.com/,Deep scraped from https://www.bakerbearing.com/,Bearings,Website Deep Scrape,2025-09-18 16:36:49,75,brian@bakerbearing.com,"(800)875-6211, 800-875-6211, (800) 808-5412"
Contact from https://www.unitedbearingcompany.com/index_php.html,shipping@unitedbearingcompany.com,972.393.9245,https://www.unitedbearingcompany.com/index_php.html,Deep scraped from https://www.unitedbearingcompany.com/index_php.html,Bearings,Website Deep Scrape,2025-09-18 16:37:11,75,"accounting@unitedbearingcompany.com, sales@unitedbearingcompany.com, purchasing@unitedbearingcompany.com, unitedbrgpurch@unitedbearingcompany.com","972.393.9260, 800.531.4464, 972.393.0922, 800-328-4323, 800.328.4323"
Contact from https://www.unitedbearingcompany.com/index_php.html,accounting@unitedbearingcompany.com,972.393.9245,https://www.unitedbearingcompany.com/index_php.html,Deep scraped from https://www.unitedbearingcompany.com/index_php.html,Bearings,Website Deep Scrape,2025-09-18 16:37:11,75,"accounting@unitedbearingcompany.com, sales@unitedbearingcompany.com, purchasing@unitedbearingcompany.com, unitedbrgpurch@unitedbearingcompany.com","972.393.9260, 800.531.4464, 972.393.0922, 800-328-4323, 800.328.4323"
Contact from https://www.unitedbearingcompany.com/index_php.html,sales@unitedbearingcompany.com,972.393.9245,https://www.unitedbearingcompany.com/index_php.html,Deep scraped from https://www.unitedbearingcompany.com/index_php.html,Bearings,Website Deep Scrape,2025-09-18 16:37:11,75,"accounting@unitedbearingcompany.com, sales@unitedbearingcompany.com, purchasing@unitedbearingcompany.com, unitedbrgpurch@unitedbearingcompany.com","972.393.9260, 800.531.4464, 972.393.0922, 800-328-4323, 800.328.4323"
Custom Boxes & Custom Packaging Manufacturer in USA,,,https://7customboxes.com/,"7 Custom Boxes is a wholesale packaging company that has helped thousands of businesses create a brand identity in their industries through our custom boxes and bags. As the leading manufacturer and supplier of custom boxes in the USA, we focus on pr","Custom packaging, boxes",DuckDuckGo Search,2025-09-18 16:39:44,35,,
Brimar Packaging USA,,,https://brimarpackaging.com/,"American manufacturers deserve American quality packaging to store, ship and showcase their products. We make premium American made boxes and offer exceptional customer service. Your supply chain belongs at home.","Custom packaging, boxes",DuckDuckGo Search,2025-09-18 16:39:44,35,,
Custom Boxes Wholesale,,,https://blackbirdpackaging.com/,"BlackBird Packaging is a leading company that prints and packages custom boxes for Retail, CBD, Cosmetics, Food, Gifts, etc in USA. Get free Quote!","Custom packaging, boxes",DuckDuckGo Search,2025-09-18 16:39:44,35,,
Custom Boxes Manufacturer,,866-472-5540,https://customboxeshub.com/,"Order your custom printed boxes with the best box packaging company in the USA. Call 866-472-5540 to get discounted prices, free design, and delivery services on personalized boxes.","Custom packaging, boxes",DuckDuckGo Search,2025-09-18 16:39:44,65,,
Custom Packaging Boxes,,,https://oxopackaging.com/,Get Your Custom Boxes with Logo for Every Product at Wholesale Rate OXO Packaging is a USA- based manufacturers' hub for producing all sorts of Custom Boxes in exquisite style. Your products will no longer have to be wrapped in standard boring boxes.,"Custom packaging, boxes",DuckDuckGo Search,2025-09-18 16:39:44,35,,
Custom Box Manufacturers & Suppliers,,,https://boxes4products.com/,"As one of the most trusted packaging box suppliers in the USA, we deliver high-quality, custom boxes for products across industries, from e-commerce and retail to food, beauty, and industrial supply. If you need display boxes, folding cartons, or bra","Custom packaging, boxes",DuckDuckGo Search,2025-09-18 16:39:44,35,,
Custom Packaging Boxes USA,,,https://idealcustomboxes.com/,"IdealCustomBoxes® is the solution for your Custom Packaging, Custom Printed Boxes, Wholesale Custom Boxes needs, and supplies. If you have any Query Or Require Further Assistance, Feel free to Contact Our Customer Service Team.","Custom packaging, boxes",DuckDuckGo Search,2025-09-18 16:39:44,35,,
Packaging Hub: Custom Boxes & Custom Packaging Supplier in USA,,,https://packaginghub.com/,Order your stylish and durable custom boxes and packaging in USA from a team of industry experts. Packaging Hub offers free design support & shipping services.,"Custom packaging, boxes",DuckDuckGo Search,2025-09-18 16:39:44,35,,
Get Custom Packaging Boxes in USA,,,https://boxlark.com/,Boxlark offers custom packaging boxes wholesale services that provide protection and branding for your products. We make custom packaging boxes to fit your design and size needs perfectly.,"Custom packaging, boxes",DuckDuckGo Search,2025-09-18 16:39:44,35,,
Contact from https://7customboxes.com/,Emailsupport@7customboxes.com,+1 234 246 7422,https://7customboxes.com/,Deep scraped from https://7customboxes.com/,"Custom packaging, boxes",Website Deep Scrape,2025-09-18 16:39:51,75,support@7customboxes.com,"(234) 246-7422, 234 246 7422, (971) 808-1814"
Contact from https://7customboxes.com/,support@7customboxes.com,+1 234 246 7422,https://7customboxes.com/,Deep scraped from https://7customboxes.com/,"Custom packaging, boxes",Website Deep Scrape,2025-09-18 16:39:51,75,support@7customboxes.com,"(234) 246-7422, 234 246 7422, (971) 808-1814"
Contact from https://blackbirdpackaging.com/,sales@blackbirdpackaging.com,501-344-6135,https://blackbirdpackaging.com/,Deep scraped from https://blackbirdpackaging.com/,"Custom packaging, boxes",Website Deep Scrape,2025-09-18 16:40:07,75,,
Contact from https://oxopackaging.com/,sales@oxopackaging.com,(510) 500-9533,https://oxopackaging.com/,Deep scraped from https://oxopackaging.com/,"Custom packaging, boxes",Website Deep Scrape,2025-09-18 16:40:27,75,,
Contact from https://boxes4products.com/,info@boxes4products.com,(888) 812-3933,https://boxes4products.com/,Deep scraped from https://boxes4products.com/,"Custom packaging, boxes",Website Deep Scrape,2025-09-18 16:40:39,75,,8888123933
Contact from https://packaginghub.com/,sales@packaginghub.com,(914) 770-3205,https://packaginghub.com/,Deep scraped from https://packaginghub.com/,"Custom packaging, boxes",Website Deep Scrape,2025-09-18 16:40:59,75,,
Dairy equipment & milk processing plant manufacturers in USA,,,https://www.smengimech.com/usa/,"SM Engineering, a well-known Manufacturer, Wholesalers and Suppliers of Bulk Milk Coolers located in USA. We respond to the different demands of the industries by offering the best range of Mini Dairy Plant, Milk Processing Plant, and Dairy Processin",Dairy Equipment,DuckDuckGo Search,2025-09-18 16:41:47,35,,
New & Used Dairy Equipment,,,https://schiercompany.com/,"Your Source for New & Used Dairy Processing Equipment Welcome to Schier Company, Inc., your premier destination for top-quality new and used dairy processing equipment in the USA. With an unparalleled inventory and a legacy of excellence dating back ",Dairy Equipment,DuckDuckGo Search,2025-09-18 16:41:47,35,,
New & Used Dairy Processing Equipment,,,https://www.heritage-equipment.com/industries/dairy-processing-equipment.html,"Dairy Processing Equipment Manufacturers When it comes to industrial dairy processing equipment, precision and sanitation are vital in producing a quality end product. At Heritage Equipment Company, we understand this. Our experience has allowed us t",Dairy Equipment,DuckDuckGo Search,2025-09-18 16:41:47,35,,
Homepage,,,https://ullmers.com/,"Whether you're looking to buy or sell dairy equipment, need a refurbish, or require custom fabrication, Ullmer's Dairy Equipment & Fabrication is your trusted partner. Our dedication to quality and personalized service makes us the premier choice for",Dairy Equipment,DuckDuckGo Search,2025-09-18 16:41:47,35,,
Dairy Processing Equipment,,,https://www.tessadm.com/,"Tessa's 3A & CE-certified dairy processing equipment includes pasteurizers, bottlers, churns, and more. It is built for quality, efficiency, and compliance.",Dairy Equipment,DuckDuckGo Search,2025-09-18 16:41:47,35,,
CK Manufacturing,,,https://www.ckmanufacturing.com/,CK Manufacturing is your leading dairy equipment manufacturer and dairy equipment supplier. Contact us today to learn more!,Dairy Equipment,DuckDuckGo Search,2025-09-18 16:41:47,35,,
Dairy Processing,,,https://www.paulmueller.com/industries/dairy-processing-equipment,"Optimize your dairy operations with the milk supply chain management solutions from Paul Mueller Company. Our equipment ensures efficiency, traceability, and quality control at every stage, from farm to processing.",Dairy Equipment,DuckDuckGo Search,2025-09-18 16:41:47,35,,
Dairy Machinery Manufacturers and Suppliers in the USA and Canada,,,https://www.thomasnet.com/suppliers/usa/dairy-machinery-46471009,"Manufacturer of machinery for dairy, dry cleaning, food processing and textile applications. Products available include steam and condensing hot water boilers and heaters.",Dairy Equipment,DuckDuckGo Search,2025-09-18 16:41:47,35,,
Dairy Equipments Manufacturers in United States,,,https://www.milkmandairyequipment.com/united-states/,"Our equipment in United States is designed using cutting-edge technology and high-grade materials, ensuring that our customers get the best possible results. Whether you are a small-scale dairy farmer or a large commercial dairy processing plant in U",Dairy Equipment,DuckDuckGo Search,2025-09-18 16:41:47,35,,
"Milk Processing Equipment Manufacturers USA, Milk Processing Equipment ...",sales@machinesequipments.com,,https://www.machinesequipments.com/usa/food-processing-plants-and-line/milk-processing-equipment,"You can contact us by email at sales@machinesequipments.com for reliable food machines supplier, we are well-known for our world-class Milk Processing Machines and one-stop bulk and trustable food processing machines manufacturers in USA.",Dairy Equipment,DuckDuckGo Search,2025-09-18 16:41:47,80,,
Contact from https://www.smengimech.com/usa/,info@smengimech.com,+1(630) 965-1843,https://www.smengimech.com/usa/,Deep scraped from https://www.smengimech.com/usa/,Dairy Equipment,Website Deep Scrape,2025-09-18 16:42:16,75,,(630) 965-1843
Contact from https://ullmers.com/,Sales@ullmers.com,(920) 822-8266,https://ullmers.com/,Deep scraped from https://ullmers.com/,Dairy Equipment,Website Deep Scrape,2025-09-18 16:42:44,75,sales@ullmers.com,
Contact from https://ullmers.com/,sales@ullmers.com,(920) 822-8266,https://ullmers.com/,Deep scraped from https://ullmers.com/,Dairy Equipment,Website Deep Scrape,2025-09-18 16:42:44,75,sales@ullmers.com,
Contact from https://www.tessadm.com/,Sales@tessadm.com,(347) 322-0443,https://www.tessadm.com/,Deep scraped from https://www.tessadm.com/,Dairy Equipment,Website Deep Scrape,2025-09-18 16:42:55,75,"Sales_wc@tessadm.comUK, info@driehoeven.com",(213) 210-4079
Contact from https://www.tessadm.com/,Sales_wc@tessadm.comUK,(347) 322-0443,https://www.tessadm.com/,Deep scraped from https://www.tessadm.com/,Dairy Equipment,Website Deep Scrape,2025-09-18 16:42:55,75,"Sales_wc@tessadm.comUK, info@driehoeven.com",(213) 210-4079
Contact from https://www.tessadm.com/,info@driehoeven.com,(347) 322-0443,https://www.tessadm.com/,Deep scraped from https://www.tessadm.com/,Dairy Equipment,Website Deep Scrape,2025-09-18 16:42:55,75,"Sales_wc@tessadm.comUK, info@driehoeven.com",(213) 210-4079
Contact from https://www.ckmanufacturing.com/,sales@ckmanufacturing.com,717-464-2166,https://www.ckmanufacturing.com/,Deep scraped from https://www.ckmanufacturing.com/,Dairy Equipment,Website Deep Scrape,2025-09-18 16:43:03,75,,
Meats Suppliers,,,https://www.thomasnet.com/suppliers/usa/meats-97014221,"Manufacturer of frozen and ready-to-cook meat products for the foodservice industry. Products include gluten-free plant-based meat, beef crumbles, chicken tenders, sausages, burger patties and meatballs. More + Contact Supplier Request Information",Meat Mfg,DuckDuckGo Search,2025-09-18 16:47:56,35,,
Trusted Authorities in Meat Packaging and Processing,,,https://www.standardmeat.com/,"Born in Texas, the heart of North America, Standard Meat has grown into a global supplier of custom meat portioning, cooking, and packaging solutions for the food service industry, retail and e-commerce partners, and meal-kit companies.",Meat Mfg,DuckDuckGo Search,2025-09-18 16:47:56,35,,
Jensen Meat Co.,,,https://jensenmeat.com/,"ABOUT US History Jensen Meat Company, founded in 1958 by Reggie Jensen, is a leading processor of quality ground beef products for the Food Service Distribution, Restaurant, Retail and School markets. Our commitment is to provide the best looking, be",Meat Mfg,DuckDuckGo Search,2025-09-18 16:47:56,35,,
Wholesale Meat Supplier,,,https://www.karnmeats.com/,"Your Custom Wholesale Meat Processor & Supplier of Fully Cooked Human Grade Pet Food Components Located in the heart of Columbus, Ohio Karn Meats, Inc. is one of the largest independently owned meat processors in the Midwest. Our central Ohio locatio",Meat Mfg,DuckDuckGo Search,2025-09-18 16:47:56,35,,
The 15 Best Meat Manufacturers,,,https://www.keychain.com/manufacturer/meat,"Keychain aims to make contract manufacturing research easy. We examined company size, longevity, and relevance in the meat market to put together the list of the best meat manufacturers in the United States.",Meat Mfg,DuckDuckGo Search,2025-09-18 16:47:56,35,,
Home,,,https://www.bernicesfoods.com/,"Bernice's Foods, Inc. is a premier manufacturer of custom prepared fresh foods and contract food processor / packer. Our experience, equipment and flexible production methodologies enable us to offer a broad variety of food products that meet the hig",Meat Mfg,DuckDuckGo Search,2025-09-18 16:47:56,35,,
32+ Food Manufacturing Companies in the United States to Know [2023],,,https://partnerslate.com/learningcenter/food-manufacturing-companies-united-states/,What does a food manufacturing company do? Many food manufacturing companies in the United States are direct links between farmers and consumers. They process raw materials that are edible into consumable products for people. There are three basic ca,Meat Mfg,DuckDuckGo Search,2025-09-18 16:47:56,35,,
Top 17 Food Manufacturing Companies in the US,,,https://www.inven.ai/company-lists/top-17-food-manufacturing-companies-in-the-us,"The food manufacturing industry in the US plays a crucial role in the economy by transforming raw agricultural products into consumable goods. Companies in this sector range from large corporations to local enterprises, focusing on a wide variety of ",Meat Mfg,DuckDuckGo Search,2025-09-18 16:47:56,35,,
Private Label Meats Manufacturers and Suppliers in the USA ...,,,https://www.thomasnet.com/suppliers/usa/private-label-meats-97012942,Custom manufacturer of private label meats including chicken for the food and beverage industries. FDA approved. More + Contact Supplier Request Information,Meat Mfg,DuckDuckGo Search,2025-09-18 16:47:56,35,,
Contact from https://www.karnmeats.com/,info@karnmeats.com,(614) 252-8273,https://www.karnmeats.com/,Deep scraped from https://www.karnmeats.com/,Meat Mfg,Website Deep Scrape,2025-09-18 16:48:32,75,,"(614) 252-3712, (800) 221-9585"
Contact from https://www.inven.ai/company-lists/top-17-food-manufacturing-companies-in-the-us,Sourcescrub@inven.aiSign,501-1000190,https://www.inven.ai/company-lists/top-17-food-manufacturing-companies-in-the-us,Deep scraped from https://www.inven.ai/company-lists/top-17-food-manufacturing-companies-in-the-us,Meat Mfg,Website Deep Scrape,2025-09-18 16:49:03,75,,"001-5000194, 501-1000201, 001-5000192, 501-1000191, 001-1000019, 001-5000199, 001-5000198, 001-5000193"
List Of Wholesale Beef Suppliers & Vendors In The USA,,,https://howtocookwithvesna.com/wholesale-beef-suppliers-vendors-in-usa/,"Weinstein Wholesale Meats Inc. can provide to a wide range of wholesale, retail, and food service clients because of its comprehensive protein offerings (beef, pig, chicken, lamb, and veal).",Meat/Wholesale,DuckDuckGo Search,2025-09-18 16:49:52,35,,
AA Meat Products Inc,,,https://aa-meat.com/,"At Meat Products Inc, we're dedicated to building lasting relationships with our customers, suppliers, and community. We strive to make every interaction a positive one, whether you're shopping online or visiting our store.",Meat/Wholesale,DuckDuckGo Search,2025-09-18 16:49:52,35,,
Wms Foods USA,,,https://wmsfoods.us/,"WMS Foods USA Global Excellence in Food Production and Distribution At WMS Foods USA, we proudly partner with the world's premier meat suppliers to produce top-quality beef, making more than 50 containers available daily to our global customer base.",Meat/Wholesale,DuckDuckGo Search,2025-09-18 16:49:52,35,,
Wholesale Meat Supplier,,,https://www.sterlingfoods-inc.com/,Sterling Foods Inc.- Wholesale Meat Supplier. We are the leaders in portion control and further-process protein products.,Meat/Wholesale,DuckDuckGo Search,2025-09-18 16:49:52,35,,
Meats Suppliers,,,https://www.thomasnet.com/suppliers/usa/meats-97014221,"Manufacturer of frozen and ready-to-cook meat products for the foodservice industry. Products include gluten-free plant-based meat, beef crumbles, chicken tenders, sausages, burger patties and meatballs. More + Contact Supplier Request Information",Meat/Wholesale,DuckDuckGo Search,2025-09-18 16:49:52,35,,
Wholesale Meats Supplier,,,https://miamibeef.com/,"Providing quality burgers, ground beef, hand cut steaks and other meat items for over 100 years, globally. Proudly family owned. Hablamos Español.",Meat/Wholesale,DuckDuckGo Search,2025-09-18 16:49:52,35,,
The Trusted Meat Trading Company,,,https://meatcomm.com/,We use our 200+ collective years of industry experience to assist meat packers across the country expand their customer base and add value to their business. We help companies big and small source raw materials from our supplier base of 200+ USDA est,Meat/Wholesale,DuckDuckGo Search,2025-09-18 16:49:52,35,,
Meat Directory,,,https://meats.regionaldirectory.us/,"This Meats directory includes meat supplier pages for every State in the USA plus Washington, DC. Each State and District page lists meat suppliers located in that State or District, including their company or website names as well as their locations",Meat/Wholesale,DuckDuckGo Search,2025-09-18 16:49:52,35,,
Monarch,,,https://www.monarchllc.com/,"Distributing the finest wholesale beef, pork, lamb, mutton, poultry, and seafood from vendors all across the U.S. and overseas.",Meat/Wholesale,DuckDuckGo Search,2025-09-18 16:49:52,35,,
Contact from https://aa-meat.com/,sales@aa-meat.com,,https://aa-meat.com/,Deep scraped from https://aa-meat.com/,Meat/Wholesale,Website Deep Scrape,2025-09-18 16:50:31,75,,
Contact from https://www.sterlingfoods-inc.com/,sterlingfoods.inc@gmail.com,(305) 953-8899,https://www.sterlingfoods-inc.com/,Deep scraped from https://www.sterlingfoods-inc.com/,Meat/Wholesale,Website Deep Scrape,2025-09-18 16:50:51,75,,
Contact from https://miamibeef.com/,sales@miamibeef.com,(305) 620-4562,https://miamibeef.com/,Deep scraped from https://miamibeef.com/,Meat/Wholesale,Website Deep Scrape,2025-09-18 16:51:22,75,info@miamibeef.com,"305.621.3252, 305.620.4562, (305) 621-3252"
Contact from https://miamibeef.com/,info@miamibeef.com,(305) 620-4562,https://miamibeef.com/,Deep scraped from https://miamibeef.com/,Meat/Wholesale,Website Deep Scrape,2025-09-18 16:51:22,75,info@miamibeef.com,"305.621.3252, 305.620.4562, (305) 621-3252"
Contact from https://meatcomm.com/,help@wp-support.com,877-404-7229,https://meatcomm.com/,Deep scraped from https://meatcomm.com/,Meat/Wholesale,Website Deep Scrape,2025-09-18 16:51:32,75,info@meatcomm.com,"800-523-5382, +1 877-404-7229"
Contact from https://meatcomm.com/,info@meatcomm.com,877-404-7229,https://meatcomm.com/,Deep scraped from https://meatcomm.com/,Meat/Wholesale,Website Deep Scrape,2025-09-18 16:51:32,75,info@meatcomm.com,"800-523-5382, +1 877-404-7229"
Kani International Inc,,,https://www.kanigranites.com/,"Memorial Monuments Wholesale Supplier Kani international Inc., is a leading manufacturer and distributor of Granite and Bronze memorials serving monument Retailers, Funeral homes and Cemeteries in the USA. If you are a monument retailer dedicated to ",Monuments,DuckDuckGo Search,2025-09-18 16:52:30,35,,
Coldspring,,,https://www.coldspringusa.com/,"At Coldspring, we have over a century of experience helping funeral home directors, cemetery engineers, monument dealers, architects, building contractors and more design and install spectacular structures, memorials and commercial projects. Our exte",Monuments,DuckDuckGo Search,2025-09-18 16:52:30,35,,
"Granite Monuments, Mausoleums & Columbaria Wholesaler",,,https://www.salemstones.com/,"Salem Stones supplies customizable granite monuments to monument retailers, cemeteries, funeral homes, and religious and government organizations in every region of the country.",Monuments,DuckDuckGo Search,2025-09-18 16:52:30,35,,
